basepk,hid,speechdate,pid,opid,speakeroldname,speakerposition,maintopic,subtopic,subsubtopic,speechtext,speakerparty,speakerriding,speakername,speakerurl
4656746,ca.proc.d.2016-04-12.17220.0,2016-04-12,18e36567-4082-4ce3-a35b-d4aba65560ca,9835,"Mr. David Lametti (Parliamentary Secretary to the Minister of International Trade, Lib.)",,Routine Proceedings,Foreign Affairs,,"Mr. Speaker, on behalf of the Minister of Foreign Affairs and pursuant to Standing Order 32(2), I have the honour to table, in both official languages, the treaty entitled “Ministerial Declaration on Trade in Information Technology Products” adopted in Nairobi on December 16, 2015.",Liberal,LaSalle--Émard--Verdun,David Lametti,
4656747,ca.proc.d.2016-04-12.17220.1,2016-04-12,79ed56c5-9960-4de7-bf05-9cd4aa51dbf5,9417,"Mr. Pat Finnigan (Miramichi—Grand Lake, Lib.)",,Routine Proceedings,Committees of the House,Agriculture and Agri-Food,"Mr. Speaker, I have the honour to present, in both official languages, the second report of the Standing Committee on Agriculture and Agri-Food in relation to its study of the main estimates for the fiscal year 2016-17.",Liberal,Miramichi--Grand Lake,Pat Finnigan,
4656748,ca.proc.d.2016-04-12.17220.2,2016-04-12,07cf5767-802c-406c-92a7-7dc92af79b40,4264,"Mr. Kevin Lamoureux (Parliamentary Secretary to the Leader of the Government in the House of Commons, Lib.)",,Routine Proceedings,Business of the House,,"Mr. Speaker, there have been discussions among the parties, and if you seek it, I think you will find unanimous consent for the following motion. I move:
 That, notwithstanding the provisions of any Standing Order, for the remainder of 2016, when a recorded division is to be held on a Tuesday, Wednesday or Thursday, except recorded divisions deferred to the conclusion of oral questions, the bells to call in the Members shall be sounded for not more than thirty minutes. 
",Liberal,Winnipeg North,Kevin Lamoureux,http://www.parl.gc.ca/parlinfo/Files/Parliamentarian.aspx?Item=07cf5767-802c-406c-92a7-7dc92af79b40&Language=E&Section=ALL
4656749,ca.proc.d.2016-04-12.17220.3,2016-04-12,3176068f-62ee-4b2f-aacd-1131201c6db1,242,The Speaker,,Routine Proceedings,Business of the House,,Does the hon. parliamentary secretary have the unanimous consent of the House to propose the motion?,Liberal,Halifax West,Geoff Regan,http://www.parl.gc.ca/parlinfo/Files/Parliamentarian.aspx?Item=3176068f-62ee-4b2f-aacd-1131201c6db1&Language=E&Section=ALL
4656750,ca.proc.d.2016-04-12.17220.4,2016-04-12,,,,intervention,Routine Proceedings,Business of the House,, Agreed.,,,Some hon. members,
4656751,ca.proc.d.2016-04-12.17220.5,2016-04-12,3176068f-62ee-4b2f-aacd-1131201c6db1,242,The Speaker,,Routine Proceedings,Business of the House,, The House has heard the terms of the motion. Is it the pleasure of the House to adopt the motion?,Liberal,Halifax West,Geoff Regan,http://www.parl.gc.ca/parlinfo/Files/Parliamentarian.aspx?Item=3176068f-62ee-4b2f-aacd-1131201c6db1&Language=E&Section=ALL
4656752,ca.proc.d.2016-04-12.17220.6,2016-04-12,,,,intervention,Routine Proceedings,Business of the House,, Agreed.,,,Some hon. members,
4656753,ca.proc.d.2016-04-12.17220.7,2016-04-12,3176068f-62ee-4b2f-aacd-1131201c6db1,242,The Speaker,,Routine Proceedings,Business of the House,,(Motion agreed to),Liberal,Halifax West,Geoff Regan,http://www.parl.gc.ca/parlinfo/Files/Parliamentarian.aspx?Item=3176068f-62ee-4b2f-aacd-1131201c6db1&Language=E&Section=ALL
4656754,ca.proc.d.2016-04-12.17220.8,2016-04-12,eaa6694f-1e20-4aae-ad3b-e694b0e12c59,9187,"Ms. Elizabeth May (Saanich—Gulf Islands, GP)",,Routine Proceedings,Petitions,HIV/AIDS,"Mr. Speaker, I rise today to present two petitions.
The first is from constituents in my riding of Saanich—Gulf Islands calling on the government to move to a national strategy on HIV/AIDS, particularly based on the principle of treatment as prevention.",Green Party,Saanich--Gulf Islands,Elizabeth May,http://www.parl.gc.ca/parlinfo/Files/Parliamentarian.aspx?Item=eaa6694f-1e20-4aae-ad3b-e694b0e12c59&Language=E&Section=ALL
4656755,ca.proc.d.2016-04-12.17220.9,2016-04-12,eaa6694f-1e20-4aae-ad3b-e694b0e12c59,9187,"Ms. Elizabeth May (Saanich—Gulf Islands, GP)",,Routine Proceedings,Petitions,Security Certificates,"Mr. Speaker, the second petition deals with the very troubling ongoing issue of the violation of human rights and the Charter of Rights and Freedoms in the use of security certificates. In particular, the petitioners are very concerned that security certificates risk deportation to countries that conduct torture.",Green Party,Saanich--Gulf Islands,Elizabeth May,http://www.parl.gc.ca/parlinfo/Files/Parliamentarian.aspx?Item=eaa6694f-1e20-4aae-ad3b-e694b0e12c59&Language=E&Section=ALL
4656756,ca.proc.d.2016-04-12.17220.10,2016-04-12,cad621a1-daf5-4d48-b500-1fc5344b5646,456,"Mr. David Sweet (Flamborough—Glanbrook, CPC)",,Routine Proceedings,Petitions,Health,"Mr. Speaker, I have a petition, signed by dozens of my constituents, who are concerned about the imbalance in health care that was created by the government with regard to health care provided to regular Canadian citizens versus that provided to refugees presently.",Conservative,Flamborough--Glanbrook,David Sweet,http://www.parl.gc.ca/parlinfo/Files/Parliamentarian.aspx?Item=cad621a1-daf5-4d48-b500-1fc5344b5646&Language=E&Section=ALL
4656757,ca.proc.d.2016-04-12.17220.11,2016-04-12,07cf5767-802c-406c-92a7-7dc92af79b40,4264,"Mr. Kevin Lamoureux (Parliamentary Secretary to the Leader of the Government in the House of Commons, Lib.)",,Routine Proceedings,Questions on the Order Paper,,"Mr. Speaker, I ask that all questions be allowed to stand.",Liberal,Winnipeg North,Kevin Lamoureux,http://www.parl.gc.ca/parlinfo/Files/Parliamentarian.aspx?Item=07cf5767-802c-406c-92a7-7dc92af79b40&Language=E&Section=ALL
4656758,ca.proc.d.2016-04-12.17220.12,2016-04-12,3176068f-62ee-4b2f-aacd-1131201c6db1,242,The Speaker,,Routine Proceedings,Questions on the Order Paper,,Is that agreed?,Liberal,Halifax West,Geoff Regan,http://www.parl.gc.ca/parlinfo/Files/Parliamentarian.aspx?Item=3176068f-62ee-4b2f-aacd-1131201c6db1&Language=E&Section=ALL
4656759,ca.proc.d.2016-04-12.17220.13,2016-04-12,,,,intervention,Routine Proceedings,Questions on the Order Paper,, Agreed.,,,Some hon. members,
4656760,ca.proc.d.2016-04-12.17220.14,2016-04-12,50a18bf1-9be3-4563-b657-6af367453ba0,11,"Mr. Charlie Angus (Timmins—James Bay, NDP)",,Routine Proceedings,Request for Emergency Debate,Situation in Indigenous Communities,"Mr. Speaker, suicide in indigenous communities is an international scandal. The entire world is appalled at the scale of the tragedy in northern communities and is urging the Government of Canada to take action. I therefore request an emergency debate about this tragedy because it is happening not just in Attawapiskat, but in all indigenous communities in Canada.
The crisis in Attawapiskat has gathered world attention, and people are looking to this Parliament to explain the lack of hope that is not just in Attawapiskat but in so many indigenous communities. They are looking to us in this new Parliament to offer change.
I am asking for this emergency debate because we do not have the opportunity in this session of Parliament to raise this through opposition day motions. We have raised individual questions in the House of Commons; however, that is not sufficient to be able to address the lack of mental health services, police services, and community supports in so many of the communities.
 Also, question period is not sufficient for Parliament to talk about how we can actually build a national response, working with indigenous youth, families, and leaders, to actually bring a hopeful solution.
In closing, the Prime Minister called the situation in Attawapiskat heartbreaking, but it is up to us as parliamentarians to turn this into a moment of hope-making. That is why I am asking my colleagues to work with me, to work together, to discuss this issue tonight, and to start to lay a path forward to give hope to the children of our northern and all our indigenous communities.",New Democratic Party,Timmins--James Bay,Charlie Angus,http://www.parl.gc.ca/parlinfo/Files/Parliamentarian.aspx?Item=50a18bf1-9be3-4563-b657-6af367453ba0&Language=E&Section=ALL
4656761,ca.proc.d.2016-04-12.17220.15,2016-04-12,3176068f-62ee-4b2f-aacd-1131201c6db1,242,The Speaker,,Routine Proceedings,Request for Emergency Debate,Speaker's Ruling,"I thank the hon. member for Timmins—James Bay for this request for an emergency debate. I note the gravity of this situation, and I believe this does meet the exigencies of the Standing Order. I therefore grant an emergency debate for this evening.",Liberal,Halifax West,Geoff Regan,http://www.parl.gc.ca/parlinfo/Files/Parliamentarian.aspx?Item=3176068f-62ee-4b2f-aacd-1131201c6db1&Language=E&Section=ALL
4656762,ca.proc.d.2016-04-12.17220.16,2016-04-12,,,,stagedirection,Government Orders,The Budget,Financial Statement of Minister of Finance," The House resumed from April 11 consideration of the motion that this House approve in general the budgetary policy of the government, and of the amendment, and of the amendment to the amendment.",,,,
4656763,ca.proc.d.2016-04-12.17220.17,2016-04-12,a5384703-9cfa-4420-b899-8c14c919115a,9608,"Mr. Marwan Tabbara (Kitchener South—Hespeler, Lib.)",,Government Orders,The Budget,Financial Statement of Minister of Finance,"Mr. Speaker, I am going to be splitting my time today with the member for Burlington.
I rise today to speak to the budget that was delivered by our hon. Minister of Finance, but before I begin, I would like to take a moment to sincerely thank my constituents of Kitchener South—Hespeler for the trust they have placed in me. I truly am blessed and honoured to represent them here in Ottawa. 
Also I would like to thank all the volunteers and donors who played a vital and critical role in the election campaign. I cannot thank them enough for their hard work and commitment. From the bottom of my heart, I truly appreciate their efforts and thank them very much. I would not be here without them.
Because time is limited, I will focus on five key areas in budget 2016: the middle-class tax cut, the child benefit, the historic infrastructure plan, benefits to seniors, and help for young people. However, first I would like to establish some context by telling everyone about the people of Kitchener South—Hespeler, the electoral district I represent here in the House.
Kitchener South—Hespeler is a new electoral district created in Waterloo region. I know Kitchener South—Hespeler very well. It is where I grew up and have lived most of my life. I would be remiss if I didn't say how beautiful it is. There are two rivers that run through it, the Speed and the Grand, where people canoe and fish to their hearts' content in the summer and fall.
Historic Hespeler Village has been the setting for many movies and TV series. The natural settings are a photographer's delight. There are lots of hiking trails and green space, and plenty of soccer fields and baseball diamonds to play on.
Right in the centre of the riding, there is the 165-acre Chicopee Ski and Summer Resort, where families hike and bike in the summer and ski and snowboard in the winter. We are a blend of suburban settings with a lot of manufacturing and business parks, Canada's premier polytechnic, Conestoga College, some regional government and health institutions, and all the usual retail providers.
The most recent data from Statistics Canada tells us that the residents of Kitchener South—Hespeler number about 98,000 people, 23,000 of whom are children under age 18, and 10% of us are seniors, around 10,000. Our average age is 36.
This means that my riding has many young families that will be assisted by our child benefit plan, which I will get to in a moment. 
In brief, Kitchener South—Hespeler is home to the middle class and those seeking to join the middle class. 
The budget is one that will grow the middle class and help hard-working Canadians keep more money in their pockets.
For nearly a decade the middle class has seen stagnant growth, lack of job opportunities, and cuts to services. Real wages have not seen a significant increase for many years, and house prices keep increasing, making it harder for the average Canadian to enter the market. 
Families are working longer hours, overtime shifts, night shifts, and even two jobs just to make ends meet. At what cost are Canadian families forced to work two jobs and long hours? This is robbing them of time better spent with family.
I will be addressing five key areas of budget 2016. The first commitment is the middle-class tax cut.
Our Liberal government knows that, when we have a strong, healthy, and vibrant middle class, we have a strong Canada. I am sure all in the House will agree that we live in the greatest country on earth. It is up to us as elected officials to keep Canada great and prosperous, but with the shrinking middle class, some of us have lost hope, lost hope that no matter how hard families are working, their efforts are not leading to greater wealth and prosperity. Great opportunities in a great country are slipping away from average Canadians. 
However, during the election campaign we listened to Canadians. We heard their concerns and we made a promise to Canadians that we will help the middle class and we will stand next to them and ensure opportunity and prosperity can and will be achieved under our Prime Minister and our current government. 
As of 2016, we have cut taxes for the middle class from 22% down to 20.5%. This is a much-needed 7% tax reduction, which will benefit nine million Canadians. This means the average individual will save up to $670 per year.
The second commitment is the child benefit plan.
With the new child benefit plan, nine out of ten families will benefit. Hundreds of thousands of children will be lifted out of poverty. This represents an essential core value, a value that ensures all children in this country have a fair chance at success in achieving their goals and aspirations.
This child benefit plan is dear to my heart. Coming from a single-parent household, I can appreciate how this plan will make a significant and positive impact upon many families.
This child benefit plan is tax free; it is better targeted for those families which need it the most, and it is more generous. Families will see an average increase in child benefits of almost $2,300 more per child.
This is a great plan, a plan that not only helps parents with the high cost of raising children, but it also helps long term. When we assist one individual like a single mother with a generous child benefit plan, we provide her and her children with the opportunity to succeed. This is a long-term plan that will build and grow our nation, with more generous assistance to those who need it the most. We are helping to change the trajectory of many families toward prosperity for a better future.
The third commitment is an historic infrastructure investment plan.
This is a promise that the Liberal government would strengthen the middle class, create jobs, and grow Canada's economy by making a historic new investment in the kind of infrastructure projects that our community needs, such as public transit, affordable housing, early learning and child care, cultural and recreational facilities, and green infrastructure that will adapt to climate change.
The fourth commitment is to seniors.
The Liberal government made a series of promises to protect income splitting for seniors, to restore the OAS and GIS eligibility back to the age of 65, and to increase the GIS payments to single seniors. I am happy to stand here today in support of the fulfillment of this promise to ensure that our government is helping those who have worked hard in building this great nation.
The fifth and final commitment is to young people.
It is important that we help young Canadians succeed in our country's prosperity. It depends upon the young generation. That is why it is vital that youth get the training they need to prepare for the jobs of today and tomorrow. That is why budget 2016 proposes to increase Canada student grants by 50%.
Furthermore, our government is committed to making student debt more manageable. No student will have to repay their loan if he or she is not earning at least $25,000 per year. I am happy to stand here today in support of that fulfillment of the commitment to helping young Canadians succeed in their studies.
We understand that the middle class is struggling. Middle-class Canadians have not been able to get ahead. They are not able to assist their children in post-secondary education. They are not able to save for their much-deserved retirement, and they are struggling to keep their homes. That is why we are focused on helping the middle class. We understand that the middle class plays a critical role as the engine of growth. The prosperity of our country lies in the hands of the middle-class Canadians. When middle-class Canadians are given the tools and opportunity to succeed, they go above and beyond. Their passion and drive leads them to great success, here at home and abroad. 
That is why, with our tax cut to middle-class families, our child benefit plan, our infrastructure investment plan, our help to seniors, and our assistance for youth, we will build an even better Canada, a Canada that we can be proud of, a Canada where every child, senior, and individual has a fair and equal opportunity for a brighter future. We live in the greatest nation on earth, and with our 2016 budget, we will keep Canada great. That is our commitment, and that is what we will deliver to Canadians.",Liberal,Kitchener South--Hespeler,Marwan Tabbara,
4656764,ca.proc.d.2016-04-12.17220.18,2016-04-12,4437c848-d8c7-4a39-a948-1539969f3a90,10459,"Ms. Marilyn Gladu (Sarnia—Lambton, CPC)",,Government Orders,The Budget,Financial Statement of Minister of Finance,"Mr. Speaker, if I do the math under this new budget for middle-class families, I see an extra $600 a year for the middle-class income tax reduction. I see another $2,200 for the child benefit, if there are a couple of kids. However, I see that they lose $3,000 for the tax fitness credit if they have a couple of kids. They would lose another $3,000 or more, if they think about income splitting, then maybe $200 more for CPP increases, and another maybe $100 for EI. That means that all of these middle-class Canadians will be paying about $3,500 or more in taxes, and that is before we put in the carbon tax. In fact, everyone under this budget will be paying more taxes.
Has the member done the math?",Conservative,Sarnia--Lambton,Marilyn Gladu,
4656765,ca.proc.d.2016-04-12.17220.19,2016-04-12,a5384703-9cfa-4420-b899-8c14c919115a,9608,Mr. Marwan Tabbara,Interjection,Government Orders,The Budget,Financial Statement of Minister of Finance,"Mr. Speaker, I have done the math, but I do not think the member has checked our child benefit plan. It targets nine out of ten families, and it would lift over 300,000 children out of poverty. As an example, a single mother making $45,000 a year with one child under six, would get roughly $2,300 more under our plan. I think the member is missing the math on this one.",Liberal,Kitchener South--Hespeler,Marwan Tabbara,
4656766,ca.proc.d.2016-04-12.17220.20,2016-04-12,50a18bf1-9be3-4563-b657-6af367453ba0,11,"Mr. Charlie Angus (Timmins—James Bay, NDP)",,Government Orders,The Budget,Financial Statement of Minister of Finance,"Mr. Speaker, in looking at the budget, I still feel that we are dealing with this shell game, with promises made but not necessarily kept in terms of indigenous children. What we are talking about is that 30% of that money will be the next government's mandate. That is not closing the gap; that is just putting out a press release. 
We see that in child welfare the government is refusing to meet the standards. Cindy Blackstock said that the government is failing indigenous children. My real concern is that there are zero dollars to deal with the health care issues, particularly the mental health crisis in indigenous communities. With the suicide pandemic in so many communities, it astounds me that there are zero dollars to address health care in the budget. I want to ask my hon. colleague why the Liberals felt that was something they could skimp on.",New Democratic Party,Timmins--James Bay,Charlie Angus,http://www.parl.gc.ca/parlinfo/Files/Parliamentarian.aspx?Item=50a18bf1-9be3-4563-b657-6af367453ba0&Language=E&Section=ALL
4656767,ca.proc.d.2016-04-12.17220.21,2016-04-12,a5384703-9cfa-4420-b899-8c14c919115a,9608,Mr. Marwan Tabbara,Interjection,Government Orders,The Budget,Financial Statement of Minister of Finance,"Mr. Speaker, first I would like to tell the hon. member that my heart goes out to everyone who is suffering in Attawapiskat right now.
Our commitment was to invest in indigenous communities. That is why we have invested billions of dollars in indigenous communities. We are working with the provinces and territories to look at a better health care system, and hopefully we will come out with a great plan. We are working to discuss with provinces and territories on the best way forward with that.",Liberal,Kitchener South--Hespeler,Marwan Tabbara,
4656768,ca.proc.d.2016-04-12.17220.22,2016-04-12,07cf5767-802c-406c-92a7-7dc92af79b40,4264,"Mr. Kevin Lamoureux (Parliamentary Secretary to the Leader of the Government in the House of Commons, Lib.)",,Government Orders,The Budget,Financial Statement of Minister of Finance,"Mr. Speaker, I applaud the member on his speech. In essence, he encapsulated a number of positive things that are coming out of this particular budget. One of the underlying themes in the budget is that it is trying to build a healthier, stronger middle class. Ultimately, if we have a healthier middle class in Canada, we will have a healthier economy. 
I wonder if the member might want to provide some of his thoughts in regard to how important it is that we give additional strength to our middle class. If we look at the core of this budget, we are saying that Canada needs a healthier middle class. This budget would in fact meet that need. Would the member not agree?",Liberal,Winnipeg North,Kevin Lamoureux,http://www.parl.gc.ca/parlinfo/Files/Parliamentarian.aspx?Item=07cf5767-802c-406c-92a7-7dc92af79b40&Language=E&Section=ALL
4656769,ca.proc.d.2016-04-12.17220.23,2016-04-12,a5384703-9cfa-4420-b899-8c14c919115a,9608,Mr. Marwan Tabbara,Interjection,Government Orders,The Budget,Financial Statement of Minister of Finance,"Mr. Speaker, I do agree. The middle class is vital. In my speech, I said it is the economic engine of this country. We need to ensure that we are helping the middle class in order for those people to achieve prosperity and health, and to achieve a great future for their children.
In my region of Waterloo, we are investing in the middle class, in transit, and we are investing in the high-tech sector. That is how we can grow our middle class.",Liberal,Kitchener South--Hespeler,Marwan Tabbara,
