basepk,hid,speechdate,pid,opid,speakeroldname,speakerposition,maintopic,subtopic,subsubtopic,speechtext,speakerparty,speakerriding,speakername,speakerurl
4657086,ca.proc.d.2016-04-12.17220.340,2016-04-12,50a18bf1-9be3-4563-b657-6af367453ba0,11,"Mr. Charlie Angus (Timmins—James Bay, NDP)",,Emergency Debate,Situation in Indigenous Communities,,"Mr. Speaker, I want to thank my hon. colleague for taking the time to participate in this debate. For people back home, when they hear numbers being thrown around, they do sound very impressive: $200 million in health; $300 million in the present, which has been stabilized funding. However, the issue happening on the ground is a crisis in community after community.
 We have some great programs, such as brighter futures, the community health and well-being program, which do some really good work. We have suicide posters in all the communities. However, I go into communities where they have the posters on the wall, and when a child is in need, the wait times to get seen are extraordinarily long. What happens is that indigenous affairs will turn down that child for counselling, and then the child will have to go to Health Canada and it will turn them down. By the time they finish that back and forth, that child has either gone to ground or we have lost him.
I think it is important in the discussion tonight that we get our heads outside of Ottawa. The bureaucrats, the ministers, and politicians will make it all sound great. However, on the ground, those dollars are not helping in the way they need to help. That is what I am asking my colleagues to work toward. Can we find a way to break through that, so that the people who need it are getting the services required to save the children and give them the help?",New Democratic Party,Timmins--James Bay,Charlie Angus,http://www.parl.gc.ca/parlinfo/Files/Parliamentarian.aspx?Item=50a18bf1-9be3-4563-b657-6af367453ba0&Language=E&Section=ALL
4657087,ca.proc.d.2016-04-12.17220.341,2016-04-12,9fb311fc-3875-4698-b13c-014f0d819393,55,Mr. Colin Carrie,Interjection,Emergency Debate,Situation in Indigenous Communities,,"Mr. Speaker, I want to thank my colleague for the question. We all realize that he is on the ground. I think his participation tonight, and also asking for this debate and allowing us to discuss it, helps to bring this issue to the forefront.
I know, being a health care professional, that he is absolutely right. We have to ensure that the dollars are being utilized properly on the ground, and we have to be open to looking at things in a different way.
I know from my travels to remote first nation communities that what is important is that we start to put forward the importance of respecting culture and historical ways of moving these communities forward. I think with the understanding and compassion of learning what has been done in the past and what has worked successfully, we maybe have to take a step back so we can embrace these things moving forward into the future. I thank my colleague for that.",Conservative,Oshawa,Colin Carrie,http://www.parl.gc.ca/parlinfo/Files/Parliamentarian.aspx?Item=9fb311fc-3875-4698-b13c-014f0d819393&Language=E&Section=ALL
4657088,ca.proc.d.2016-04-12.17220.342,2016-04-12,cd83ba99-0c5b-4f51-a42b-a73504b91199,10273,"Hon. Jody Wilson-Raybould (Minister of Justice and Attorney General of Canada, Lib.)",,Emergency Debate,Situation in Indigenous Communities,,"Mr. Speaker, I want to thank the hon. member across the way for Timmins—James Bay for providing us with this very important opportunity to have this substantive discussion. I certainly want to acknowledge all members who are in the House to participate in this debate.
I am very proud to come from the small community of We Wai Kai, off the west coast of British Columbia. I am proud to be an indigenous person standing in this honourable House to speak to this important subject, the issues of indigenous peoples in our country, and to participate in the debate. 
I add my name to the many names of people who have spoken with respect to the incredibly sad situation that exists in Attawapiskat, and in communities like La Loche and so many indigenous communities across the country, where we see conditions of poverty, despair and lack of hope. As an indigenous person who was raised to be proud of who I am and where I come from, when I look at indigenous communities across the country, I want to ensure that we collectively create that sense of hope and that sense that if they work hard, they can achieve anything they want to in our country.
I want to applaud all of the members who have spoken to this issue and who recognize that immediate measures need to take place within the community of Attawapiskat, and other communities.
I am here today as the Minister of Justice and a member of this honourable House, and I would like to speak to the critical work that is ahead of us all.
I thank my colleagues, the Minister of Health and the Minister of Indigenous and Northern Affairs, for recognizing the importance of not only addressing the immediate needs and the situation that exists, but for understanding the need for meaningful and systemic change. We, in the House, must not lose sight of the role this change will have in ensuring the health and safety of communities like Attawapiskat. Collectively, we must chart a path forward.
 The Prime Minister has tasked us to work with indigenous peoples to establish a nation-to-nation relationship that is based on recognition. A relationship based on recognition is transformative. It is a relationship based on respect, co-operation, and partnership. In doing so, we can make real progress.
 As the former regional chief of the BC Assembly of First Nations, I had the great fortune and opportunity to work with the chiefs and community leaders in British Columbia to develop mechanisms and to build institutions of government to assist first nations in the transition. I did this as well as a council member in my home community of We Wai Kai.
 Indigenous peoples from across the country are at an important juncture in our history as they seek to deconstruct their colonial legacy and rebuild their communities. We all have a role to play. Even with political will, support and resources, only the colonized can decolonize themselves.
 Change is not easy. It is not easy to remove the shackles of 140 years of life under the Indian Act. Our government, and I hope all members of this honourable House, is committed to ensuring that we work in partnership with indigenous peoples to do just that. Relationships with indigenous peoples in Canada are of paramount importance, and we are committed to renewed relationships that recognize that solutions to one of the biggest outstanding public policy issues in our country need to be addressed in a substantive way. 
For Attawapiskat, and for all first nations, the Indian Act is not a suitable system of government. It is not consistent with the rights enshrined in our Constitution, the principles as set out in the UN Declaration on the Rights of Indigenous Peoples, or the calls to action in the Truth and Reconciliation Commission report.
In addition to the need for social and economic support urgently needed in Attawapiskat, all first nations, all indigenous peoples, need to be empowered to take back control of their own lives in partnership and with the full support of all Canadians. The good news is there are examples of how this can happen. There are successes in indigenous communities across the country, and we need to build on those successes.
The problem is that those successes are few and far between. Change has not happened quickly enough nor evenly throughout our great country, and Attawapiskat is one of those places. Our government is committed to establishing a nation-to-nation relationship, one, as the hon. member across the way said a moment ago, that respects an approach that will lay the framework for true reconciliation with indigenous peoples.
I have a few more words to say, Mr. Speaker, but I am pleased to share my time with the member for Thunder Bay—Rainy River. 
For indigenous peoples, the challenge is not easy. It is complex. Indeed, for far too long it has been ignored as a task, as too difficult and monumental. However, we can and must do better. This work, as has been said, is non-partisan. It is broader than the Department of Justice and it does not fall only to the Department of Indigenous and Northern Affairs.
 A nation-to-nation relationship is one of the most challenging public policy issues of our time, and I challenge all members of the House to work with us in building this relationship. There are no quick fixes to these issues. A substantive nation-to-nation discussion with indigenous peoples is needed. We need to sit down and work jointly to ensure that indigenous communities are strong and healthy, and in charge and in control of their own destiny. We need to bring life to and move beyond the scattered programs and initiatives. Reconciliation is a national project that requires full engagement and commitment at the highest levels of government.
 This transformative work in Canada is far from complete. Some positive steps have been made. There have been positive steps made in the budget but more needs to be done. We need to develop a national reconciliation framework in partnership with indigenous communities, and that requires the support of all parties and all members in the House. That reconciliation framework needs to survive the life of one government. 
We have incredible challenges to meet with respect to our relationship with our indigenous peoples. We have incredible opportunities to gain from engaging substantively. As the Minister of Justice and as one of the members in this honourable House, I look to international minimum standards that are articulated in the United Nations Declaration on the Rights of Indigenous Peoples. We need to ensure that we look at the Truth and Reconciliation Commission recommendations. We need to ensure, with respect to our relationship with indigenous peoples in the country, that we put it in place in terms of the constitutional relationship that is required with respect to section 35. We need to ensure that we breathe life into section 35 and that we complete the unfinished business of Confederation.
 In doing so, we will have strong and appropriate governance in first nations communities wherein they have moved beyond the Indian Act. We can ensure that they are benefiting from the economy, that they are playing a substantive role in our country, ensuring the ultimate objective that I believe every Canadian wants to achieve, which is to improve his or her quality of life. In assisting indigenous communities to improve their quality of life, we can ensure that the amazing cultures, languages, traditions and the pride that I felt and was taught, rooted in the potlatch which is our governing system, is felt in indigenous communities and within indigenous youth. This is our national project of reconciliation. I look forward to every member of the House standing with us and ensuring we can achieve that.
 Gilakas'la. ",Liberal,Vancouver Granville,Jody Wilson-Raybould,
4657089,ca.proc.d.2016-04-12.17220.343,2016-04-12,fa2cbab8-f429-402f-b603-ea918add87c3,9802,"Mr. Kevin Waugh (Saskatoon—Grasswood, CPC)",,Emergency Debate,Situation in Indigenous Communities,,"Mr. Speaker, we are all passionate about this, but unfortunately it has been brought up in the House that it has been 28 years. I would say we have been dealing with this issue for over a century.
One of the things that surprised me when I came to the House was the issue of education on reserves. I know the discrepancy of what first nations get from the federal government and what each jurisdiction and each province gives first nations. It is the value of education. We have been told many times that education is a way out of poverty. We have overstepped our boundaries because we have no accountability here. 
I was a school board trustee for 10 years in Saskatchewan. For the first time ever we had a premier gather all 28 school divisions together because we had been doing things the same way for centuries and we were failing. It was Premier Brad Wall. He wanted to see accountability from the school boards, from the teachers, from the parents, and from the students. He said that we needed education and we needed graduation rates to increase by 50% by 2020.
Could we have accountability in education? I am shocked that we do not have an education minister on that side dealing with this. We need accountability—",Conservative,Saskatoon--Grasswood,Kevin Waugh,
4657090,ca.proc.d.2016-04-12.17220.344,2016-04-12,3176068f-62ee-4b2f-aacd-1131201c6db1,242,The Speaker,,Emergency Debate,Situation in Indigenous Communities,,The hon. Minister of Justice and Attorney General of Canada.,Liberal,Halifax West,Geoff Regan,http://www.parl.gc.ca/parlinfo/Files/Parliamentarian.aspx?Item=3176068f-62ee-4b2f-aacd-1131201c6db1&Language=E&Section=ALL
4657091,ca.proc.d.2016-04-12.17220.345,2016-04-12,cd83ba99-0c5b-4f51-a42b-a73504b91199,10273,Hon. Jody Wilson-Raybould,Interjection,Emergency Debate,Situation in Indigenous Communities,,"Mr. Speaker, I share the member's comments with respect to the importance of education. I recognize that education is the means to unlocking the potential in indigenous people as well as all people.
In terms of education and moving forward, I am pleased to be part of a government that is investing in education. We are not only just investing in education, such as flowing money to indigenous communities, but we are looking to indigenous communities for the solutions they have developed. We are looking to indigenous communities to ensure that we can approach and embrace first nations control of first nations education. There are examples right across the country of indigenous communities stepping up, and we are working with those communities. I will continue to work with my colleague the Minister of Indigenous and Northern Affairs and government.
On the issue of accountability, indigenous communities have developed their own accountability mechanisms from first nations administration laws through education programs. We need to embrace their solutions.",Liberal,Vancouver Granville,Jody Wilson-Raybould,
4657092,ca.proc.d.2016-04-12.17220.346,2016-04-12,13a21d52-bc44-4a96-a206-f18432ef9191,8606,"Mr. Romeo Saganash (Abitibi—Baie-James—Nunavik—Eeyou, NDP)",,Emergency Debate,Situation in Indigenous Communities,,"Mr. Speaker, I have been following indigenous politics for the last 35 years, but I have not had the opportunity to hear that kind of speech on indigenous relations.
The minister referred to the United Nations Declaration on the Rights of Indigenous Peoples. She rightly pointed out that the standards that were provided for under UNDRIP were effectively the minimum standards for the survival, dignity, and well-being of indigenous peoples.
I recall when we negotiated and drafted this U.N. declaration for a period of 23 years. We tried to think about every possible situation in the indigenous world when we drafted those articles. There are a couple of articles in the declaration that refer to health, articles 21.1, 21.2, and 24.
I want to ask the minister a simple question. I have been listening carefully to the Prime Minister. I have read carefully the mandate letters to the ministers and they all refer to the implementation of UNDRIP. Call to action 43 of the TRC refers to adopting and implementing the declaration. Does the minister make that distinction? Is that a simple oversight? If we adopt legislation and we—",New Democratic Party,Abitibi--Baie-James--Nunavik--Eeyou,Romeo Saganash,http://www.parl.gc.ca/parlinfo/Files/Parliamentarian.aspx?Item=13a21d52-bc44-4a96-a206-f18432ef9191&Language=E&Section=ALL
4657093,ca.proc.d.2016-04-12.17220.347,2016-04-12,3176068f-62ee-4b2f-aacd-1131201c6db1,242,The Speaker,,Emergency Debate,Situation in Indigenous Communities,,The hon. Minister of Justice.,Liberal,Halifax West,Geoff Regan,http://www.parl.gc.ca/parlinfo/Files/Parliamentarian.aspx?Item=3176068f-62ee-4b2f-aacd-1131201c6db1&Language=E&Section=ALL
4657094,ca.proc.d.2016-04-12.17220.348,2016-04-12,cd83ba99-0c5b-4f51-a42b-a73504b91199,10273,Hon. Jody Wilson-Raybould,Interjection,Emergency Debate,Situation in Indigenous Communities,,"Mr. Speaker, I would like to acknowledge the hon. member across the way and thank him for his ongoing efforts and his commitment to ensuring the advancement of indigenous peoples in this country through such mechanisms as the United Nations Declaration on the Rights of Indigenous Peoples.
We have been very clear that we will embrace the United Nations Declaration on the Rights of Indigenous Peoples and ensure that the minimum standards that are articulated in the declaration are brought home here to Canada to ensure that we take declarations and mechanisms as such and translate them to form practical and meaningful benefits on the ground in communities here in Canada.
Under section 35, we have an opportunity with the minimum standards articulated in the declaration to ensure that we work together to define exactly what that means and how we can translate those into practical standards on the ground.",Liberal,Vancouver Granville,Jody Wilson-Raybould,
4657095,ca.proc.d.2016-04-12.17220.349,2016-04-12,57c5c196-1fdc-474f-8549-ed83eadb791f,10238,"Mr. Don Rusnak (Thunder Bay—Rainy River, Lib.)",,Emergency Debate,Situation in Indigenous Communities,,"Mr. Speaker, there can be no question that the high suicide rates experienced in first nation communities are a national tragedy. Every suicide attempt and every life lost is one too many, and there are definitely far too many, as the staggering statistics underline. 
There can also be no question that the Government of Canada is determined to work with first nations and their leadership to turn these distressing numbers around. We will do everything possible to support communities like Attawapiskat to prevent further suicides. 
While much of the attention in the past few days has focused on the situation in Attawapiskat, we all know that it is not an isolated case. The recent work of the Truth and Reconciliation Commission underscored the extent of the social breakdown in many communities, often the result of the residential school experience that damaged so many individuals and families. Suicide is the most alarming manifestation of these serious social challenges. 
The loss of life to suicide and feelings of despair affect us all. They reinforce how important it is to work with first nations and indigenous peoples across the country to address the very real challenges facing many communities. It is vital to our country's future that the government work in genuine partnership with indigenous communities and provinces to ensure better social and economic outcomes for indigenous peoples, especially youth. 
The government is currently working with all partners to design an engagement strategy for developing a national reconciliation framework. This reconciliation framework will be informed by the Truth and Reconciliation Commission's recommendations, calls to action, and the United Nations Declaration on the Rights of Indigenous Peoples. 
Through our work on reconciliation, we commit to do important work where mental wellness, intergenerational trauma, poverty, child welfare, justice, and discrimination intersect. Indigenous and Northern Affairs Canada and Health Canada are collaborating with other federal departments, provinces and territories, and other partners to look at long-term needs in mental health, child welfare, education, infrastructure, and employment in indigenous communities.
Specific to mental health challenges, “Changing Directions Changing Lives”, Canada's mental health strategy, has placed a priority on working with first nations, Inuit, and Métis to address their distinct mental health needs. Priorities for action have been developed through dialogue between the Mental Health Commission of Canada and indigenous organizations. 
Following discussions with Mr. Justice Murray Sinclair, chair of the TRC, the Mental Health Commission of Canada pledged to bring a greater depth of understanding to indigenous issues through activities and capacity-building related to cultural competencies. It has created the position of senior adviser of indigenous affairs and is providing indigenous cultural competency training to all staff. 
Of course, making real change also requires a new fiscal relationship with first nations, a relationship that provides sufficient, predictable, and sustained funding for communities, and that is what budget 2016 delivers, because there is no relationship more important to this government than the one with indigenous peoples. 
We know first nations, Inuit, Métis, and northern communities need urgent action now. That is why budget 2016 invests a historic $8.4 billion over five years to improve the socio-economic conditions of indigenous peoples and their communities. 
As the chief of Attawapiskat First Nation told reporters this week, indigenous suicide is not just a mental health problem. Unemployment, lack of access to education, and substandard infrastructure are contributing factors. Economic hardships and the legacy of colonialism are key factors in high suicide rates also.
 Understanding this, the Government of Canada is taking a comprehensive approach to social investments, from repairing and constructing homes and schools on reserve to providing early childhood development programs, from increasing supports for child and family services to boosting funds for skills development and job training. 
We are keeping our promises for a renewed relationship with indigenous peoples, one based on recognition of rights, respect, co-operation, and partnership—in short, reconciliation—a relationship that provides sufficient, predictable, and sustained funding to first nations and indigenous communities, a relationship based on the understanding that unilateral decision-making and top-down solutions do not reflect the needs of indigenous peoples, and a relationship that understands that a secure personal and cultural identity is the bedrock of success for their communities. 
The budget and our efforts to date demonstrate this government's commitment to closing the gaps and ensuring social justice.
As we move forward together in a spirit of reconciliation, honouring and respecting the cultural identity of indigenous people, we will sow the seeds for a more promising future to give youth both hope and opportunity to create a better country for us all.",Liberal,Thunder Bay--Rainy River,Don Rusnak,
4657096,ca.proc.d.2016-04-12.17220.350,2016-04-12,53eb10e4-f8e7-4ef7-9448-b4a10ec1dba3,9804,"Mrs. Cathay Wagantall (Yorkton—Melville, CPC)",,Emergency Debate,Situation in Indigenous Communities,,"Mr. Speaker, I really appreciate this opportunity we have tonight to discuss this issue. The comments from the leadership on the other side of the House as well as here have been really encouraging to me.
As a member of Parliament who has three reserves in my riding, I want to say that we need to work together and that I need the help of hon. members.
When I hear that we need to be empowering the people in their bands, I fully support that idea. As the minister knows, I have individuals coming to my office who are dealing with an incredible amount of loss of hope, partially because of what we discussed in this room tonight—our responsibilities as a country for colonialism and government—and partly because they are people who are not getting the support they need from their band leadership.
Politics exists at every level, and when I was running for office, I studied reserves and found that there are reserves in this country that, as the minister said, are doing phenomenally well. I believe they are doing really well because they have strong leadership on the ground in reserves where they value their people.
I am a new member of Parliament. I am at an age when I am really not interesting in pretending or playing politics. I want results for the people living on reserves in my riding who, quite frankly, live in fear and do not where the money is or where it has gone, and they want that education. However, we have very complex issues here. ",Conservative,Yorkton--Melville,Cathay Wagantall,
4657097,ca.proc.d.2016-04-12.17220.351,2016-04-12,57c5c196-1fdc-474f-8549-ed83eadb791f,10238,Mr. Don Rusnak,Interjection,Emergency Debate,Situation in Indigenous Communities,,"Mr. Speaker, I have been dealing with and working with first nations communities in Alberta, British Columbia, and northern Ontario, and I can tell the hon. member that all members of first nations governments want to see the best for their communities. No one wants to see the horrible tragedy that occurred in Attawapiskat or the other tragedies that have occurred across the country.
To lump all first nations communities into the same category, the pan-aboriginal approach, is not productive. We need to talk to each individual first nations community and have them develop their own solutions. We as a government, with our provincial partners, need to work with them to solve the problems in the communities.",Liberal,Thunder Bay--Rainy River,Don Rusnak,
