basepk,hid,speechdate,pid,opid,speakeroldname,speakerposition,maintopic,subtopic,subsubtopic,speechtext,speakerparty,speakerriding,speakername,speakerurl
4656837,ca.proc.d.2016-04-12.17220.91,2016-04-12,ee06377a-6024-40ae-9fe4-a059508592a4,9437,"Mr. Wayne Long (Saint John—Rothesay, Lib.)",,Government Orders,The Budget,Financial Statement of Minister of Finance,"Mr. Speaker, I thank the member opposite for his passionate speech, but again I need to point out that the party opposite has a twisted view of economics and of the last 10 years.
This is a party that ran seven straight deficits. This is a party that came forth with a smokescreen surplus in the last year of its mandate by throwing in EI funds, GM stock sale funds, and then the rainy-day fund. Let me be very clear. The rainy-day fund maybe could have been used to help the province of Alberta, but the Conservatives did not. . 
Alberta's problems did not happen in the last five or six months; they happened over the last 10 years. Therefore, the party opposite is very responsible for the same economic position that we see today.
The member talked about mortgaging our future for our children and our grandchildren. Was it not the Conservative's former finance minister who said that Mr. Harper's grandchildren were going to have to pay for the tax-free savings account?",Liberal,Saint John--Rothesay,Wayne Long,
4656838,ca.proc.d.2016-04-12.17220.92,2016-04-12,02c2cb20-f27d-46a5-8e78-ab4b405bf07b,453,The Deputy Speaker,,Government Orders,The Budget,Financial Statement of Minister of Finance,"I would remind the hon. member that the right hon. member for the riding of Calgary Heritage remains a member of this House, and we do not use the proper names of other hon. members.
The hon. member for Edmonton West.",Conservative,Simcoe North,Bruce Stanton,http://www.parl.gc.ca/parlinfo/Files/Parliamentarian.aspx?Item=02c2cb20-f27d-46a5-8e78-ab4b405bf07b&Language=E&Section=ALL
4656839,ca.proc.d.2016-04-12.17220.93,2016-04-12,62c4052f-dd41-418a-9b5b-1715c0baa84d,9445,Mr. Kelly McCauley,Interjection,Government Orders,The Budget,Financial Statement of Minister of Finance,"Mr. Speaker, it is important to revisit the member's comments. 
If you go back in time, I think you will remember that it was your party that teamed up with the separatist Bloc Québécois and the NDP, and the coalition demanded an immediate $50-billion deficit. This was during the worst economic period since the Great Depression. We are not in a great economic recession. The economy is actually growing now. It is mind-boggling that the member would compare massive irresponsible deficit spending during a time of economic growth with a time of great collapse.
With regard to your comment about Alberta, I would point out the Conservative's support for the province of Alberta. In the last 10 years of a Conservative government, there was $3.4 billion of infrastructure spending. Let us go back 10 years to the Liberal era. I have to put my reading glasses on because the number is so small. There was $351 million for Alberta. Therefore, do not sit over there and lecture me on supporting my home province.",Conservative,Edmonton West,Kelly McCauley,
4656840,ca.proc.d.2016-04-12.17220.94,2016-04-12,02c2cb20-f27d-46a5-8e78-ab4b405bf07b,453,The Deputy Speaker,,Government Orders,The Budget,Financial Statement of Minister of Finance,"I would remind the hon. member to address his comments and responses, all remarks in fact in the House, to the Chair.
Questions and comments, the hon. member for Regina—Lewvan.",Conservative,Simcoe North,Bruce Stanton,http://www.parl.gc.ca/parlinfo/Files/Parliamentarian.aspx?Item=02c2cb20-f27d-46a5-8e78-ab4b405bf07b&Language=E&Section=ALL
4656841,ca.proc.d.2016-04-12.17220.95,2016-04-12,5848c1f7-b3d9-4dd3-af1c-019e0a321f7a,9984,"Mr. Erin Weir (Regina—Lewvan, NDP)",,Government Orders,The Budget,Financial Statement of Minister of Finance,"Mr. Speaker, I would like to thank the member for Edmonton West for his remarks. It has been a pleasure working with him on the government operations committee.
He is quite right to point to the hard economic times in Edmonton and that his city is very deserving of being included in the budget's extension of employment insurance benefits. Things are even worse in my province of Saskatchewan, which is not benefiting from the progressive policies of Rachel Notley's government. The last labour force survey from Statistics Canada showed that full-time employment in Saskatchewan had fallen by 2.4% over the past year, the largest drop of any province west of Prince Edward Island.
I wonder if the member for Edmonton West would agree that Regina and southern Saskatchewan also need to be included in the budget's extension of employment insurance benefits.",New Democratic Party,Regina--Lewvan,Erin Weir,
4656842,ca.proc.d.2016-04-12.17220.96,2016-04-12,62c4052f-dd41-418a-9b5b-1715c0baa84d,9445,Mr. Kelly McCauley,Interjection,Government Orders,The Budget,Financial Statement of Minister of Finance,"Mr. Speaker, I thank my colleague from Regina—Lewvan for his question. I hope he enjoyed a wonderful week in Edmonton, my hometown, recently.
I agree with him that the EI policy needs to be reviewed for Regina as well. The region includes a lot of hard-hit oil areas, and it is disgraceful that the Liberal government is not addressing this issue. 
I will take offence to his comments about our colleague Rachel Notley. I think she is more of a hindrance than a help in Alberta, but I fully agree with my colleague that there needs to be more for Regina and the hard-hit people in that region as well.",Conservative,Edmonton West,Kelly McCauley,
4656843,ca.proc.d.2016-04-12.17220.97,2016-04-12,38f0d8dc-9c1c-4c89-be68-08ebe484b50b,409,"Mrs. Sylvie Boucher (Beauport—Côte-de-Beaupré—Île d'Orléans—Charlevoix, CPC)",,Government Orders,The Budget,Financial Statement of Minister of Finance,"Mr. Speaker, I have the privilege of rising in the House to speak to the budget.
On March 22, I listened carefully as the Minister of Finance presented this government's budget. The Liberals are using a line of credit without worrying about the limit. This is a far cry from their election promise to borrow a modest sum of $10 billion a year, which was completely ridiculous, in my opinion. That amount was set aside and replaced with an amount of no less than $30 billion for this year alone.
I am wondering whether Canadians think that a deficit of over $100 billion over four years is a modest deficit.
What is more, I was not at all surprised to learn that the Liberals had no plan to return to a balanced budget. That term has been deleted from the Liberal dictionary. The Liberals are promising to put our country into debt, but they have not presented any sort of plan or approach for putting an end to this spending spree. 
Since we are debating the budget, I would like to remind the House that government budgets involve spending other people's money. The government members, on the other side of the House, seem to have all too easily forgotten that.
It seems as though the Minister of Finance closed his eyes, took a shot, and hoped to hit as many targets as possible. This is an unfocused, directionless budget.
The budget does not have a plan for how and when to return to a balanced budget. However, the government will make up the difference by increasing taxes for families, young people, and businesses.
This government should take some more time to think about the families in our ridings that are having a hard time making ends meet, paying their mortgages, and paying their grocery and other bills.
Families are already footing the bill for the Liberals' spending promises through increases in the costs associated with enrolling children in sports, arts programs, and post-secondary studies.
The Liberals abolished income splitting, the children's fitness tax credit, the children's arts tax credit, and the post-secondary education and textbook tax credits. While the Liberals are busy spending other people's money, it is easy for them to forget that they have access to all of this money as a result of the former Conservative government's policies, not their own. 
We implemented targeted stimulus programs to help create and maintain about 200,000 jobs. We kept our promise to balance the budget, and we left the Liberals a $3.2-billion surplus. We lowered taxes to the lowest rates in 50 years and we put more money back into Canadians' pockets, while at the same time balancing the budget.
Unfortunately, instead of focusing on lowering taxes for Canadian families, this government is playing politics with family benefits. On top of that, the Liberal government will force the provinces to charge a national carbon tax that will cost Canadian families about $1,000 a year. This government is not helping to grow the middle class, and Canadian families will once again pay the price.
I also noticed that this reckless budget plan will only make government bigger and will do nothing to create jobs. There is nothing to help unemployed Canadians get back to work. 
Small and medium-sized businesses are the pillars of our society and our economy, but there are no measures here to help them diversify or grow. These are the businesses that create jobs, and that is what Canadians really need right now. Those same businesses will have to foot the bill for the Liberals' spending spree.
During the campaign, the Liberals promised to cut small business taxes from 11% to 9%. Unfortunately, they got rid of that tax cut. The Minister of Small Business and Tourism even said that she would work closely with the Minister of Finance to keep their promise to reduce the small business tax burden.
The small business tax cut was undeniably a Liberal election platform promise in 2015. That promise was broken, as was the promise to cap the deficit at $10 billion.
Stability enables businesses to prosper. Budget 2016 means that the only thing businesses can be sure of is fiscal uncertainty. These businesses are important to our regions. It is clear to me that the government has completely abandoned them in this budget. There are precious few measures to foster job creation and development. 
The government decided to build on the work of the previous government, our government, to renew the broadband connection program to promote digital access, but that is the only ray of hope here for our regions.
 Here is an example of an initiative currently under way in my area. It is critical for the survival of our small businesses to make citizens aware of the impact of choosing to do their shopping close to home. 
 In my riding, in the Charlevoix area, there is currently a buy-local campaign, aimed at supporting our small and large businesses. I strongly support this campaign, because its goal is to boost our businesses with small, concrete measures, in order to preserve our stores close to home. It is this kind of initiative that we should encourage, in order to promote regional development. This is a good example to give the Liberal government.
 The government has done away with aid to the regions of Quebec and Canada. It has failed to make the necessary effort to ensure the vitality of our regions, which are the economic heart of our country.
 Unfortunately, it is not the only sector that the government has abandoned. With regard to official languages and la Francophonie, I am very disappointed in the government’s budget. There are no concrete measures to strengthen francophone and anglophone minority communities. In a country like ours, promoting bilingualism is important. I am disappointed that the government has turned its back on many of those communities. 
 In addition, as official opposition critic for la Francophonie, I was dumbfounded to see that there was no reference to Canada’s francophone partners in the budget.
At the last meeting of the Organisation internationale de la Francophonie in Dakar, the partners adopted a resolution recognizing the important role that the private sector must play in implementing the economic strategy for La Francophonie, especially its components dealing with promoting French as a language of work and a driver of economic growth.
 It is also important to strengthen co-operation with francophone regional economic communities in order to boost regional integration, which is a driver of market expansion, economic vitality and job creation. The government’s budget is a missed opportunity to pursue our commitment to la Francophonie. In my opinion, it was a good opportunity to do so.
 To conclude, I would like to say that the budget ignores a number of sectors of our society, including families, small and medium-sized businesses, and official languages, despite the lovely promise of a deficit of more than $100 billion over four years.",Conservative,Beauport--Côte-de-Beaupré--Île dOrléans--Charlevoix,Sylvie Boucher,http://www.parl.gc.ca/parlinfo/Files/Parliamentarian.aspx?Item=38f0d8dc-9c1c-4c89-be68-08ebe484b50b&Language=E&Section=ALL
4656844,ca.proc.d.2016-04-12.17220.98,2016-04-12,101111c4-d4b7-46a9-9f88-9bfa542bb606,9882,"Mr. David de Burgh Graham (Laurentides—Labelle, Lib.)",,Government Orders,The Budget,Financial Statement of Minister of Finance,"Mr. Speaker, could my colleague tell us where she gets the idea that the Conservatives were able to generate a $3.4-billion surplus between 2015 and 2016? If we look at the monthly figures instead of the annual figures, we can interpret them in all sorts of creative ways, but the reality is that the Conservative government’s balanced budget contained a deficit of more than $5 billion for the fiscal year. Indeed, there is only one Conservative prime minister who succeeded in eliminating a deficit and generating a surplus, and that dates back to the 19th century. 
Would my colleague care to admit that, historically, the Conservatives have been chronically incapable of managing a budget?",Liberal,Laurentides--Labelle,David Graham,
4656845,ca.proc.d.2016-04-12.17220.99,2016-04-12,38f0d8dc-9c1c-4c89-be68-08ebe484b50b,409,Mrs. Sylvie Boucher,Interjection,Government Orders,The Budget,Financial Statement of Minister of Finance,"Mr. Speaker, I thank my colleague for his question.
Historically, the biggest spenders have always been the Liberals. We succeeded in balancing a budget, and in Mr. Flaherty, God rest his soul, we had the best minister of finance.",Conservative,Beauport--Côte-de-Beaupré--Île dOrléans--Charlevoix,Sylvie Boucher,http://www.parl.gc.ca/parlinfo/Files/Parliamentarian.aspx?Item=38f0d8dc-9c1c-4c89-be68-08ebe484b50b&Language=E&Section=ALL
4656846,ca.proc.d.2016-04-12.17220.100,2016-04-12,ac588301-cc6e-4f6e-9c58-84542c62c46b,2703,"Mr. François Choquette (Drummond, NDP)",,Government Orders,The Budget,Financial Statement of Minister of Finance,"Mr. Speaker, I would like to thank my colleague for her speech. We work together on the Standing Committee on Official Languages, and it is truly disappointing that the Liberal government did not take this opportunity to reinvest in official languages. As you know, unfortunately, the budget for the roadmap has not been indexed for more than 12 years. Funding is frozen, and it was badly needed. The organizations need it; they are hurting at the moment. It is regrettable. 
 I would like to speak about something else that is very important in my constituency, and that is social housing. The employees of the municipal housing authority in Drummondville came to see me and told me that there were serious needs, particularly for new social housing units for single seniors. We were expecting more than a token gesture from the government; we were expecting concrete measures. Unfortunately, there is very little information about the $520 million over four years that was announced for the construction of new affordable rental units. 
 I would like to know whether the same is true in my colleague’s constituency. Would she agree that social housing needs are enormous and that it is necessary to invest to improve the living conditions of the people most in need?",New Democratic Party,Drummond,François Choquette,http://www.parl.gc.ca/parlinfo/Files/Parliamentarian.aspx?Item=ac588301-cc6e-4f6e-9c58-84542c62c46b&Language=E&Section=ALL
4656847,ca.proc.d.2016-04-12.17220.101,2016-04-12,38f0d8dc-9c1c-4c89-be68-08ebe484b50b,409,Mrs. Sylvie Boucher,Interjection,Government Orders,The Budget,Financial Statement of Minister of Finance,"Mr. Speaker, I thank my colleague for his question. I represent a rural constituency, but there is certainly a great need for social housing in the urban part. However, as we have seen, despite the $30-billion deficit promised by the Liberals, nothing has been done on this issue. Families are being ignored. Our regions are being ignored. We are asking the Liberal Party, the government, not to accept the budget, because it does not measure up to what Canadians were expecting.",Conservative,Beauport--Côte-de-Beaupré--Île dOrléans--Charlevoix,Sylvie Boucher,http://www.parl.gc.ca/parlinfo/Files/Parliamentarian.aspx?Item=38f0d8dc-9c1c-4c89-be68-08ebe484b50b&Language=E&Section=ALL
4656848,ca.proc.d.2016-04-12.17220.102,2016-04-12,bd2068aa-74c7-430a-bdf5-6f17b14ca140,9453,"Mr. Tom Kmiec (Calgary Shepard, CPC)",,Government Orders,The Budget,Financial Statement of Minister of Finance,"Mr. Speaker, I would like to thank the member for Beauport—Côte-de-Beaupré—Île d'Orléans—Charlevoix. That is a long riding name.
 I would like her to comment on one subject in particular. According to the Canadian Taxpayers Federation, the Liberal government has saddled every Canadian with a debt of $17,222. At the moment, the national debt is growing by about $1 million every 30 minutes or so. The parliamentary budget officer has had difficulty getting information from this government so that he can tell us what the estimates are for the future.
What does my colleague think of the national debt that we are going to leave our children?
What does she think about the fact that the parliamentary budget officer, Jean-Denis Fréchette, has been unable to obtain information from day one on the contents of the budget to determine whether what the Liberals printed in their budget was true?",Conservative,Calgary Shepard,Tom Kmiec,
4656849,ca.proc.d.2016-04-12.17220.103,2016-04-12,38f0d8dc-9c1c-4c89-be68-08ebe484b50b,409,Mrs. Sylvie Boucher,Interjection,Government Orders,The Budget,Financial Statement of Minister of Finance,"Mr. Speaker, I thank my hon. colleague for that excellent question.
 Obviously, as a grandmother, I find this debt absolutely horrendous. This is not the Canada I want to leave to my grandchildren. With the Liberal budget that was recently tabled, all of the promised transparency is nowhere to be found either.
 The Liberals are mortgaging future generations without considering the fact that tomorrow it is they who will have to pay for this government's unbridled spending. Quite simply, I will be voting against this budget, because for me as a grandmother, this is not the Canada that I want for my grandson.",Conservative,Beauport--Côte-de-Beaupré--Île dOrléans--Charlevoix,Sylvie Boucher,http://www.parl.gc.ca/parlinfo/Files/Parliamentarian.aspx?Item=38f0d8dc-9c1c-4c89-be68-08ebe484b50b&Language=E&Section=ALL
4656850,ca.proc.d.2016-04-12.17220.104,2016-04-12,03fec1f2-5bf7-4f22-8a1f-0a48e4b70a4e,10351,"Ms. Linda Lapointe (Rivière-des-Mille-Îles, Lib.)",,Government Orders,The Budget,Financial Statement of Minister of Finance,"Mr. Speaker, I would like to share my time with my colleague from Brampton East.
On March 22, Canadians witnessed real change with the tabling of the budget by my colleague, the Minister of Finance. As a member, a businesswoman and a person involved in my community, I can only be delighted at a budget that leaves no one behind. Seniors, families, workers, entrepreneurs, and job creators all have been presented with a budget of opportunities and above all a budget of compromise and openness. I say compromise because there is one thing we Liberals understand. We have two ears and just one mouth. As a mother of four, this is something I have often said to my children. The logic goes something like this: you have to listen twice as much as you talk. In other words, we have understood that we have to engage citizens in public affairs and listen with one ear to their concerns, but with the other to their ambitions, their dreams, and their goals for both themselves and their community. That is why the finance minister  and his parliamentary secretary toured Canada from sea to sea to listen to Canadians. I want to underscore this leadership and this openness. 
 The choice that our government made on March 22 is thus perfectly in line with the concerns of Canadians. For my part, together with my parliamentary colleague from Thérèse-De Blainville, I held a pre-budget consultation with some 50 local stakeholders who let us know their concerns and their ambitions for Rivière-des-Mille-Îles. We welcomed their ideas and we recognize that interest rates are really low. The time has come to invest in our infrastructure, in the environment, and above all in our people. 
During the election campaign, we proposed to Canadians that we invest in them. As a result, we form a majority government that knows for a fact how Canada’s economic wheel turns. Its gears are the middle class. That is why we brought in a middle-class tax cut that will benefit nine million people. That is how to walk the talk. It is also important to point out that when the middle class has more money in its pockets, all the players in our economy benefit, including our small and medium-sized businesses that work hard all year long.
 In my introduction, I raised a concept that is important to Canadians, just as it is to the people of Rivière-des-Mille-Îles. That is the concept of opportunity.
Better is always possible.
 That is why we are proposing a massive investment in infrastructure: $3.4 billion in public transit and roads, $5 billion in green infrastructure, and $3.4 billion in social infrastructure, including affordable housing and seniors’ housing. 
 I can confirm that this money is being very well received by the people in my riding, even though Rivière-des-Mille-Îles already has affordable housing, especially in Saint-Eustache and Deux-Montagnes. Municipal officials now feel as though they are being heard. Their concerns have been heard, and now they will have dedicated funds for the renovation and construction of social and community infrastructure. Furthermore, this infrastructure plan will enable me to complete, in co-operation with my counterparts in the Quebec National Assembly, the work on highways 13 and 19, as well as the broadening of highway 15 to include a public transit lane from Blainville to the Montmorency subway in Laval. 
As a government, we note that a strong economy can go along with a better environment.
As I was saying, as a mother of four, I want to leave a clean environment for future generations. Therefore, starting in 2016-17, $62.5 million will be made available to support the deployment of infrastructure for alternative transportation fuels, including charging infrastructure for electric vehicles. This measure is fully responsive to a recommendation made in the pre-budget consultation in my constituency on January 29, when local economic stakeholders made us aware of the cost of charging stations.
This is a direct measure that allows us to move forward on the electrification of transportation. After all, this is 2016.
Yes, Canada is back.
People will remember 2016 as the year when our colleague, the Minister of Families, Children and Social Development , proposed a real reform for families in Rivière-des-Mille-Îles and Canada. Budget 2016 will lift 300,000 children out of poverty thanks to a universal Canada child benefit. 
 It is therefore quite correct to say that this is not only a sizeable reform, but also the biggest federal social measure in a generation. In tangible terms, it will provide an average of $2,300 more per family per year. What is more, this money will now be non-taxable. 
 When Canadian families have resources, the entire country does better. It is therefore not abnormal to see another major measure for seniors in budget 2016. We know that seniors were worried in the weeks leading up to the tabling of the budget.
 I was able to sound out the seniors in Rivière-des-Mille-Îles, not just during the pre-budget consultations, but also when I went to meet with them. However we are proving once again that no one is being left behind in this budget. It is our responsibility to ensure that a quality retirement is available for our seniors, who worked hard to build the Canada we have today.
I am therefore very pleased about the increase in guaranteed income supplement benefits for our seniors. Not only have we lowered the retirement age from 67 to 65, but a senior citizen living alone will receive an average of $947 more each year. This is an important measure to ensure the financial well-being of elderly people.
 I am proud of the measures in budget 2016. I am certain it will benefit the Lower Laurentians region and my constituency of Rivière-des-Mille-Îles. The families, seniors, and middle-class workers in my riding have been heard, and the budget provisions not only address their concerns, but will also restore their self-confidence.
 I am very hopeful and confident regarding the people of my region, their aspirations, and their dreams. Together, we will build the Canada of tomorrow.",Liberal,Rivière-des-Mille-Îles,Linda Lapointe,
