basepk,hid,speechdate,pid,opid,speakeroldname,speakerposition,maintopic,subtopic,subsubtopic,speechtext,speakerparty,speakerriding,speakername,speakerurl
4658454,ca.proc.d.2016-04-19.17232.234,2016-04-19,ffeab63b-041e-4d87-bdad-1b79ff9a98c5,9713,"Mr. Dan Vandal (Saint Boniface—Saint Vital, Lib.)",,Government Orders,Business of Supply,Opposition Motion—Political Fundraising Activities,"Mr. Speaker, I am having a hard time believing the hon. member and her party are serious, notwithstanding the fact that the Minister of Justice has a ruling in writing from the Ethics Commissioner that no breach of ethics occurred, that no conflict of interest occurred and notwithstanding the fact that the hon. member represents a party that found was guilty on the in-and-out scandal. It was guilty on the robocalls scandal. It blatantly tried to suppress the vote through the conflict of unfair elections act. The former prime minister's former chief of staff gave $90,000 cheque to Mr. Duffy. As well, the parliamentary secretary to the former prime minister was led out in shackles and went to jail.
That party is guilty of everything I have mentioned. Therefore, do you actually believe Canadians feel you have any credibility whatsoever when you talk about ethical scandals?",Liberal,Saint Boniface--Saint Vital,Dan Vandal,
4658455,ca.proc.d.2016-04-19.17232.235,2016-04-19,16c839d3-0183-4ed6-892a-8d7bdc37c474,249,The Assistant Deputy Speaker (Mr. Anthony Rota),,Government Orders,Business of Supply,Opposition Motion—Political Fundraising Activities,"Once again I want to remind members that they are speaking through the Speaker and not directly to each other. Otherwise this could turn into a real hodgepodge of things.
The hon. member for Elgin--Middlesex.",Liberal,Nipissing--Timiskaming,Anthony Rota,http://www.parl.gc.ca/parlinfo/Files/Parliamentarian.aspx?Item=16c839d3-0183-4ed6-892a-8d7bdc37c474&Language=E&Section=ALL
4658456,ca.proc.d.2016-04-19.17232.236,2016-04-19,16ec30ba-16f2-4777-ab8d-db372238e239,9568,Mrs. Karen Vecchio,Interjection,Government Orders,Business of Supply,Opposition Motion—Political Fundraising Activities,"Mr. Speaker, that was an easy question for me. I am 100% serious.",Conservative,Elgin--Middlesex--London,Karen Vecchio,
4658457,ca.proc.d.2016-04-19.17232.237,2016-04-19,38f0d8dc-9c1c-4c89-be68-08ebe484b50b,409,"Mrs. Sylvie Boucher (Beauport—Côte-de-Beaupré—Île d'Orléans—Charlevoix, CPC)",,Government Orders,Business of Supply,Opposition Motion—Political Fundraising Activities,"Mr. Speaker, I cannot get over what I just heard my Liberal friends say. I would remind them that they still owe Canadians $40 million.
That being said, I totally agree with my colleague. Does she believe there was a perceived conflict of interest on the part of the Minister of Justice? Should the minister reimburse Canadians?",Conservative,Beauport--Côte-de-Beaupré--Île dOrléans--Charlevoix,Sylvie Boucher,http://www.parl.gc.ca/parlinfo/Files/Parliamentarian.aspx?Item=38f0d8dc-9c1c-4c89-be68-08ebe484b50b&Language=E&Section=ALL
4658458,ca.proc.d.2016-04-19.17232.238,2016-04-19,16ec30ba-16f2-4777-ab8d-db372238e239,9568,Mrs. Karen Vecchio,Interjection,Government Orders,Business of Supply,Opposition Motion—Political Fundraising Activities,"Mr. Speaker, I absolutely believe 100% that the justice minister should give that money back to the people who attended.
I will remind everybody in here that we were elected in the same way members on the opposite side were elected. I came here with the idea of working with others. I have been heckled today by the backbenchers on the opposite side. There is a gentleman who did not listen to my 10 minute speech. I sit here, I listen, and I almost laugh. The hypocrisy drives me crazy. If we are to sit here as parliamentarians and do things for Canadians, then we must live with what we say. Is the government going to be doing things sunny ways? 
As the member of Parliament for Elgin—Middlesex—London, I wonder why we are seriously discussing this. It is because the Prime Minister promised Canadians transparency, the accountability, and the truth, and that promise is not being upheld.",Conservative,Elgin--Middlesex--London,Karen Vecchio,
4658459,ca.proc.d.2016-04-19.17232.239,2016-04-19,2c7cfe15-cb1e-43c5-831d-6ad09d4a16b6,9285,"Mr. Arnold Chan (Scarborough—Agincourt, Lib.)",,Government Orders,Business of Supply,Opposition Motion—Political Fundraising Activities,"Mr. Speaker, I find it concerning that I am even rising in today's debate. The issues that have been raised recently remind me of the Shakespeare comedic play Much Ado About Nothing.
The point members opposite, including the member for Elgin—Middlesex—London, are raising is the appearance of a conflict and I want to get specifically to that, which is the nature of my question.
If we are to apply the same standard that those members seek to apply to us, would the member also be willing to go back through 10 years of records when her party served in government, go through each of the records of the members of its executive council to see whether they had stakeholders attend their fundraisers when ministers attended as the guest speaker? Did they return the money to Canadians as well where there was that appearance?",Liberal,Scarborough--Agincourt,Arnold Chan,
4658460,ca.proc.d.2016-04-19.17232.240,2016-04-19,16ec30ba-16f2-4777-ab8d-db372238e239,9568,Mrs. Karen Vecchio,Interjection,Government Orders,Business of Supply,Opposition Motion—Political Fundraising Activities,"Mr. Speaker, I think all parliamentarians agree that we need to move forward in a more positive manner for Canada. We talk about what the NDP did and the $40 billion. We talk about the scandals. 
Nobody in the House is perfect, but from this day forward, the new Government of Canada and members of Parliament should rise above this. Everybody wants to sit here and throw mud. How about we rise above that? If this is what the Prime Minister is asking us to do, all members of Parliament should rise above it and live up to those standards, including the ministers.",Conservative,Elgin--Middlesex--London,Karen Vecchio,
4658461,ca.proc.d.2016-04-19.17232.241,2016-04-19,16c839d3-0183-4ed6-892a-8d7bdc37c474,249,The Assistant Deputy Speaker (Mr. Anthony Rota),,Government Orders,Business of Supply,Opposition Motion—Political Fundraising Activities,"It is my duty pursuant to Standing Order 38 to inform the House that the question to be raised tonight at the time of adjournment is as follows: the hon. member for Saint-Hyacinthe—Bagot, International Trade.",Liberal,Nipissing--Timiskaming,Anthony Rota,http://www.parl.gc.ca/parlinfo/Files/Parliamentarian.aspx?Item=16c839d3-0183-4ed6-892a-8d7bdc37c474&Language=E&Section=ALL
4658462,ca.proc.d.2016-04-19.17232.242,2016-04-19,44647433-13cb-467e-8632-d49b131d5bb6,166,"Hon. Dominic LeBlanc (Leader of the Government in the House of Commons, Lib.)",,Government Orders,Air Canada Public Participation Act,Bill C-10—Notice of time allocation motion,"I would like to advise that an agreement could not be reached under the provisions of Standing Order 78(1) or 78(2) with respect to the second reading stage of Bill C-10, an act to amend the Air Canada Public Participation Act and to provide for certain other measures.
Under the provisions of Standing Order 78(3), I give notice that a minister of the Crown will propose at the next sitting day a motion to allot a specific number of days or hours for the consideration and disposal of proceedings at the said stage.",Liberal,Beauséjour,Dominic LeBlanc,http://www.parl.gc.ca/parlinfo/Files/Parliamentarian.aspx?Item=44647433-13cb-467e-8632-d49b131d5bb6&Language=E&Section=ALL
4658463,ca.proc.d.2016-04-19.17232.243,2016-04-19,,,,stagedirection,Government Orders,Business of Supply,Opposition Motion — Political Fundraising,The House resumed consideration of the motion.,,,,
4658464,ca.proc.d.2016-04-19.17232.244,2016-04-19,78336f0e-962c-47d2-a5b8-b59a26592789,8491,"Mr. Matthew Dubé (Beloeil—Chambly, NDP)",,Government Orders,Business of Supply,Opposition Motion — Political Fundraising,"Mr. Speaker, we just heard a notice of closure motion. That is timely because I was going to start my speech by saying that this is a fine debate that reminds us of the old saying, “Liberal, Tory, same old story”. That is what we have here.
Today's debate is on political fundraising issues, which often come up in the news and never for good reasons, unfortunately. We are in a situation where the Conservative Party opposition motion calls on the Minister of Justice to apologize and return the money.
She is being asked to follow the example of a Conservative Party minister, Shelly Glover, who, in a similar situation, returned all the money she collected. If we are setting the bar to meet a standard created by the Conservatives, then that bar is not very high and easy to jump over. I would hope that the Minister of Justice will be able to do so.
I want to talk about a number of points raised in this debate. First, with regard to political fundraising, I heard the Leader of the Government in the House of Commons answer questions in question period by saying that every member participates in political fundraising, that there is nothing unusual about doing so, and that we should not worry about it. We are talking here about ministers, and their responsibilities and requirements differ from those of ordinary members. 
I am not trying to minimize the responsibilities of individual members. However, there is a big difference between a minister responsible for justice sitting down with lawyers and me being given $20 by a woman in my riding because she thinks that I do a good job and she wants me to have the resources I need to get re-elected. It seems likely that, in the case of the minister, she and the lawyers will be talking almost exclusively about subjects related to her portfolio and her department. There is a very big difference there. That is where we get into the matter of appearances.
 The code of conduct that the Prime Minister himself imposed on his ministers, for lack of a better way to say it, indicates that they cannot engage in partisan or fundraising activities that give the appearance of preferential access, the appearance of conflict of interest, or the impression that one can pay to obtain access to a minister. That is the problem. Perhaps it is the eternal optimist in me who is talking, but I would like to believe that the minister does not just lend an attentive ear to people who are prepared to pay to attend fundraisers. Once again, the problem is the way it is perceived. People see that and wonder whether someone has to be able to pay $500 or $600 to meet with the minister. 
I almost forgot. Before I continue, I would like to indicate that I will be sharing my time with my colleague from Elmwood—Transcona. I was so outraged to hear the government House leader move a motion to invoke closure after only six months in office that I completely forgot. I hope I will be forgiven.
I will come back to the matter before us. We now find ourselves in a situation where Canadians have doubts and questions. There is already too much cynicism about politics and the political system. The problem is now being exacerbated by this type of fundraising, which gives the impression that one can pay to obtain preferential access. I find that absolutely unacceptable.
When going door-to-door during and even before the election campaign, we inevitably meet people who say they could not care less about politics. I dare say this is the experience of all MPs from all parties. When you ask these people to explain why they feel that way and you try to talk about the files you are working on, the good work that MPs can do, the difference one can make as an MP, and the difference one can make in the community, quite often they will say that politicians are all dishonest and that only people with power and money have access to elected officials. It seems that the average person cannot get this type of access, nor make a difference and communicate with an elected official, an MP or even a minister, as in the situation we find ourselves in today.
This is what happens in situations like this. Although I make no assumptions about what the minister will do and what access she will provide, she has nevertheless created the impression that she will give her attention and her time more readily to those who are prepared to donate to the Liberal Party of Canada. That is unacceptable and it creates a problem for all of us. It is a big black cloud that will settle over Parliament and the political system, and it will follow us everywhere.
 I am not a member of the Liberal Party, but when I knock on doors in my riding, citizens inevitably talk to me about this situation or that situation. I reply that it is the good old Liberal Party that we all know, and I personally promise to do politics differently. However, that does not change anything, because people say that it does not matter, since politicians are all alike. As elected representatives, we have a responsibility to do better, and ministers have 10 times as much responsibility. After all, they are not just representatives of their constituencies, because they also represent institutions. Ministerial responsibility is even greater for the Minister of Justice.
 What is happening is, unfortunately, the current trend. That is not limited to the Minister of Justice. We are dealing with another case involving privileged access; just consider the case of the Minister of National Revenue. We are right in the middle of income tax season. Some people are quite happy, because they will be getting a tax refund. Others will have to write a cheque to the government. It is a happy or unhappy time of year, depending on whom you ask. Ultimately, it does not matter how those people feel; they pay their fair share, with the exception, of course, of the millionaires and the people who do business with KPMG, because they can have nice agreements with the government and benefit from tax evasion. That would not be a problem if we had not learned this week that there are cocktail buffets for senior public servants and managers who oversee investigations to combat tax evasion. Here we are again in a situation that feeds public cynicism. We are creating the perception that preferential access is possible. 
 The Minister of National Revenue, much like the leader of the government when he was defending the Minister of Justice, stood in the House and said that the people who work in the department are members of the same professional association as the people facilitating tax evasion. Therefore this was not about tax evasion; it was an opportunity to attend an event with fellow accountants.
 The problem is still one of perception. Who knows what happens at those meetings? Who knows what is discussed? Essentially, the members of the public who pay their fair share of taxes think that we have enough money to attend a little cocktail party or pay the big fee of an accountant at KPMG, which has a nice network that includes a manager or maybe even an elected representative. We hope not, but this type of situation creates a very problematic perception, because it undermines people’s confidence in their public institutions and their elected representatives. It is a completely unacceptable situation.
 In the end, this is why we will support the Conservative Party’s motion.
 In conclusion, I would like to say that although we support the motion, I would hope that we will find more urgent situations to discuss. Yes, what happened is scandalous and appalling on the part of a minister. However, when I think about the people who are losing their jobs, the debate on Bill C-10, an act to amend the Air Canada Public Participation Act and to provide for certain other measures, and the hypocrisy of the Liberals on this issue, and when I think of the people who do not have access to employment insurance, despite the government’s lovely words about changing the system, and of the issue of tax evasion, I firmly believe that despite the ethical problems that are eating away at both the Conservative Party and the Liberal Party, which have succeeded one another in power, when all is said and done, there are real people who need us to stand up in the House. People need us to hold debates on the issues that affect them personally. That is what we should be doing. We will support the motion, but we have to get back to real business and tackle those issues. It is very important to do so.
 I would like to tell everyone listening not to throw up their hands at such behaviour. They must not let cynicism control their relationship with politics. If they consider it a deplorable act, that is one more reason for them to get involved in changing the attitudes of elected representatives. 
 In 2019, a government that does not keep its promises of transparency and openness, not to mention all the other broken promises, may well be replaced. That is what we are hoping and aiming for.",New Democratic Party,Beloeil--Chambly,Matthew Dubé,http://www.parl.gc.ca/parlinfo/Files/Parliamentarian.aspx?Item=78336f0e-962c-47d2-a5b8-b59a26592789&Language=E&Section=ALL
4658465,ca.proc.d.2016-04-19.17232.245,2016-04-19,ea3bdfb2-c01b-4b31-937f-51fafc045172,9366,"Mr. Fayçal El-Khoury (Laval—Les Îles, Lib.)",,Government Orders,Business of Supply,Opposition Motion — Political Fundraising,"Mr. Speaker, I thank my colleague for his speech.
 I am asking myself this question: Are our friends on the other side of the House burying their heads in the sand? They are playing with words. It is all very well for them to attack the minister, but I am really surprised to hear a colleague say that they do not know what happened, that they do not know whom the minister spoke to, and that they do not know what the people who were with her did or whom they spoke to. That does not make sense. Do they even have to know whether the minister is talking to her husband? If they have the courage to tell the truth, if they think it is true, do they have the courage to say that the minister committed an illegal act, in the House and outside the House? Did the minister take part in an illegal activity? Let them say so in the House and outside the House.",Liberal,Laval--Les Îles,Fayçal El-Khoury,
4658466,ca.proc.d.2016-04-19.17232.246,2016-04-19,78336f0e-962c-47d2-a5b8-b59a26592789,8491,Mr. Matthew Dubé,Interjection,Government Orders,Business of Supply,Opposition Motion — Political Fundraising,"Mr. Speaker, in the context of the conversations with her husband and given the circumstances, I think we need better answers about this situation.
 I hope my colleague listened carefully to my speech. I even said that I did not question the minister’s integrity regarding her ability to listen to people. The fact remains that even if it is not illegal, we can certainly wonder whether it is ethical. That is the distinction that must be made.
 The situation is as follows: People are giving the Liberal Party of Canada $500 or $600, whatever the amount is, which gives them the impression that they have preferential access to a minister, when the code that the Prime Minister himself gave his ministers prohibits precisely that kind of situation.
 I will not say outside that this is illegal, because it is not. However, it is certainly unethical, and it is certainly a breach of the promises that were made over and over by this party during the election campaign on the subject of openness and transparency. 
 You can put “openness” and “transparency” in quotation marks, because that has not materialized, far from it.",New Democratic Party,Beloeil--Chambly,Matthew Dubé,http://www.parl.gc.ca/parlinfo/Files/Parliamentarian.aspx?Item=78336f0e-962c-47d2-a5b8-b59a26592789&Language=E&Section=ALL
4658467,ca.proc.d.2016-04-19.17232.247,2016-04-19,e277e13e-59ec-425f-a957-eb5e54d8cb62,9341,"Mr. Gérard Deltell (Louis-Saint-Laurent, CPC)",,Government Orders,Business of Supply,Opposition Motion — Political Fundraising,"Mr. Speaker, it is always a pleasure to listen to my colleague from Montreal's south shore, whose statements are always factual and well documented. I enjoy his prose very much.
 Like him, I think that it is quite normal to have this kind of debate, like many other debates we have here in the House on job creation, wealth creation, promises not kept, and the assistance we must provide or the support we must give to small and medium-sized businesses, which are the backbone of our economy.
 Like him, I have concerns about the management of public finances and ethical issues, not to mention that his party is currently in court on a matter concerning satellite offices, where 2.7 million taxpayers’ dollars are at stake; we will let the court decide.
 Here is the question I want to ask the member. He rightly noted that beyond the facts, there are also appearances, and in this case, I would like to hear what he has to say about the fact that the minister in question is the Minister of Justice.
In the member’s opinion, when a person is the justice minister, should that person have an even stricter code of ethics concerning political party fundraising than any other member of the House?",Conservative,Louis-Saint-Laurent,Gérard Deltell,
4658468,ca.proc.d.2016-04-19.17232.248,2016-04-19,78336f0e-962c-47d2-a5b8-b59a26592789,8491,Mr. Matthew Dubé,Interjection,Government Orders,Business of Supply,Opposition Motion — Political Fundraising,"Mr. Speaker, I thank my colleague for his compliments. 
I will not waste too much time recalling the bogus process that led to the partisan accusations against NDP members. I will remind my colleague of the Conservative majority on the Board of Internal Economy at the time. However, as I said, that is a debate for another day. Today, it is about the problems that ministers face.
It is about a code that the Prime Minister  himself established for the ministers. With regard to the question my colleague raised, the fact remains that ministers, including the Minister of Justice, have more responsibilities than an ordinary member, if I can use that term, because ultimately, they represent not only their constituents but also a government department and institutions. 
That is especially true for the Minister of Justice, and that is what makes this situation even more problematic.",New Democratic Party,Beloeil--Chambly,Matthew Dubé,http://www.parl.gc.ca/parlinfo/Files/Parliamentarian.aspx?Item=78336f0e-962c-47d2-a5b8-b59a26592789&Language=E&Section=ALL
