basepk,hid,speechdate,pid,opid,speakeroldname,speakerposition,maintopic,subtopic,subsubtopic,speechtext,speakerparty,speakerriding,speakername,speakerurl
4658278,ca.proc.d.2016-04-19.17232.58,2016-04-19,9ad0ff66-1598-45e6-b146-6dd0eefb9cd0,10551,"Mr. Alexander Nuttall (Barrie—Springwater—Oro-Medonte, CPC)",,Government Orders,Business of Supply,Opposition Motion—Political Fundraising Activities,"Mr. Speaker, the government has certainly brought back Liberal ethics, as the Minister of Status of Women has said, Liberal ethics that led to the sponsorship scandal, Liberal ethics that led to many issues over the years, Liberal ethics that have led to a justice minister providing access to lawyers who potentially could request positions on the bench in the future.
I will be sharing my time today with the member for Barrie—Innisfil.
Before I begin, I would like to comment on one other thing that the Minister of Status of Women said, which was that this issue is not important to Canadians. Present today, aside from many parliamentarians, are members of the Barrie and area firefighters association, who believe it is so important that they joined us in the chamber today.
I stand to speak to the motion sponsored by the member for St. Albert—Edmonton regarding the fundraising exploits of the Minister of Justice. She is not the first minister of the crown to exercise poor judgment in attending a fundraiser staged by individuals who seek to gain from their responsibilities. This has happened on numerous occasions on both sides of the House. Sometimes it was because the individual did not know, sometimes it was because the minister did not yet understand his or her position, and sometimes it was because the party was trying to raise funds and cared not for the conventions of this honourable House. 
Members on the government side will use past issues to clutter today's debate, to rationalize the legitimacy—or illegitimacy, as I see it—of the Minister of Justice's fundraising with lawyers. To put this to rest in advance, I want to outline the most applicable circumstances surrounding this issue. 
A minister in the last government attended a fundraiser for $50 per person, at which there were stakeholders present from the minister's portfolio. The minister was unaware that the event was raising funds using stakeholders from the portfolio. Subsequently, the minister returned all of the funds and addressed the situation immediately.
In the end, the Ethics Commissioner decided that while this event was not technically against the law, the commissioner stated in the ethics report's conclusion that it was “clearly inappropriate”. This sets the standard for both what is expected of a minister in not attending such a fundraiser and also how to respond in an open and honest fashion if a mistake is made in the future.
Other standards that need to be met in matters regarding fundraising are outlined by the Prime Minister. In the letter to his ministers, parliamentary secretaries, and Canadians about open and transparent conduct, the Prime Minister said the following:
 Ministers and Parliamentary Secretaries must act with honesty and must uphold the highest ethical standards so that public confidence and trust in the integrity and impartiality of government are maintained and enhanced. As public office holders, Ministers and Parliamentary Secretaries are subject to the Part I requirements of the Ethical and Political Activity Guidelines for Public Office Holders set out in Annex A, as well as the best practices for fundraising and dealing with lobbyists that are set out in Annex B. Moreover, they have an obligation to perform their official duties and arrange their private affairs in a manner that will bear the closest public scrutiny. This obligation is not fully discharged merely by acting within the law. 
I repeat, “This obligation is not fully discharged merely by acting within the law”, meaning the standard of care is not just to meet the regulation of the law of this land but to be without ethical question and to maintain the credibility of the position with the public. 
There is no question that the minister has crossed ethical lines by attending a Liberal fundraiser for members of the law society, whom she oversees.
The Minister of Justice is responsible for naming individuals to the bench and for overseeing the judicial system in Canada. Therefore, having lawyers who could be requesting appointments as judges paying money to meet the person who would appoint those judges is an obvious ethical lapse.
There can be no question regarding the minister's ethics. It would undercut the credibility of not just the Minister of Justice, but the government appointments process, and indeed, the government itself. Since the Prime Minister is failing to hold his minister to account on this matter, it leaves Canadians again questioning the legitimacy of his words, spoken and written, which are in direct contradiction to his actions that are taken or not taken.
My colleagues have clearly outlined the ethical lapses regarding the minister's fundraising practices from a parliamentary standpoint, but what about the ideal that the Canadian government is as accessible to each and every Canadian in the same way?
I would like to tell a little story.
 I had the opportunity to take a civics and careers class in high school. At the time, my family was living in government housing. I fell in love with politics, because everything I read about in those textbooks showed that if one believed enough, if one hoped long enough, if one worked hard enough, one would be able to attain all of the successes that are available in this country, not because of the amount of money one has, not because of one's age, not because of a plethora of reasons that we could come up with, but because we live in a country where each and every person is valued equally regardless of race, religion, or means, and all those other issues.
In my opinion, what this fundraiser has done is to create two classes of citizens in this country. One is the citizen who must pay to go and give feedback, input, and influence to a minister at $500 a head, and those who do not have that access, those who do not have the means to be at those meetings. What this is creating in our country is an unequal footing for those who have the financial means to show up and those who have the friends to get the invites. Quite frankly, it is wrong. It is not what our country stands for, and it is not what our government should be practising. 
When the Prime Minister during the election promised open and transparent government, when the Prime Minister during the election promised that his government would be different, this is not the different that I thought I would see. I thought we would make gains on the transparency and accountability front, but we have found the opposite.
 Not only has the minister already conducted herself in this way as a minister of the crown, but she is committed to holding another fundraiser in the future. I mentioned earlier a minister in the previous government who realized immediately that the fundraising efforts were done in an incorrect fashion and returned the money and dealt with it right away. The minister is literally doubling down, going from $500 a head to $1,000. That is not the example I want us to set for our youth, that if one has $1,000, one can meet the minister, but if one does not, then one cannot. It is wrong, and I do not believe any of these things about showing up and participating as a member of Parliament. I hope that Canadians see through this as well.
Finally, I think it is important that we know who is benefiting. Who is it that is attending these fundraisers and paying to be able to talk with a minister and perhaps influence policy or maybe even influence appointments down the road? We will find out eventually, but it is important on these matters, because of the ethical questions, that the minister be forthright, step up, and release all of the information available.",Conservative,Barrie--Springwater--Oro-Medonte,Alex Nuttall,
4658279,ca.proc.d.2016-04-19.17232.59,2016-04-19,cb8ec688-1348-4901-abf1-3230bc8d9691,9942,"Mr. Vance Badawey (Niagara Centre, Lib.)",,Government Orders,Business of Supply,Opposition Motion—Political Fundraising Activities,"Mr. Speaker, I find those comments to be quite interesting. I do understand, however, the member's cynicism being a member of a party that when in government committed atrocities and crossed the line. Some examples are the Senate hush money; contempt of Parliament; government failure to share budget information, even after a court order; granting immunity; falsifying documents; duplicity of project costs; the advertising scam; corruption; and the list goes on. With that, I do understand the cynicism of the member.
 We have asked this question many times and I would like to hear a yes or no answer: Has the integrity commissioner failed in her judgment?",Liberal,Niagara Centre,Vance Badawey,
4658280,ca.proc.d.2016-04-19.17232.60,2016-04-19,9ad0ff66-1598-45e6-b146-6dd0eefb9cd0,10551,Mr. Alexander Nuttall,Interjection,Government Orders,Business of Supply,Opposition Motion—Political Fundraising Activities,"Mr. Speaker, the integrity commissioner was very clear that there are laws that define the interaction between ministers and the public in fundraising opportunities. There are also things which she has labelled and clearly communicated as wrong, as being unethical and inappropriate. That was clearly communicated in an identical circumstance during the last government. The funds were returned in advance and all necessary measures were taken. Unfortunately, the Liberal government has failed to learn a lesson from that. Instead of learning a lesson and not conducting its activities in such a way, the Liberal government has asked how it can exploit its position and gain money for its coffers for the next election, not only once, but twice.",Conservative,Barrie--Springwater--Oro-Medonte,Alex Nuttall,
4658281,ca.proc.d.2016-04-19.17232.61,2016-04-19,2490b23e-4439-4513-9d54-6fceb6320267,10139,"Ms. Cheryl Hardcastle (Windsor—Tecumseh, NDP)",,Government Orders,Business of Supply,Opposition Motion—Political Fundraising Activities,"Mr. Speaker, my question is with regard to perception.
 Canadian taxpayers are exhausted and disillusioned, and taxpayers in my riding of Windsor—Tecumseh specifically are feeling the same way. 
Does the hon. member believe that we are ready for a comprehensive and crucial review of the Conflict of Interest Act? Is it time for us to make real meaningful changes that would address the problematic issue of perception and appearance?",New Democratic Party,Windsor--Tecumseh,Cheryl Hardcastle,
4658282,ca.proc.d.2016-04-19.17232.62,2016-04-19,9ad0ff66-1598-45e6-b146-6dd0eefb9cd0,10551,Mr. Alexander Nuttall,Interjection,Government Orders,Business of Supply,Opposition Motion—Political Fundraising Activities,"Mr. Speaker, when we are looking at any of the acts that govern the way in which we conduct ourselves as parliamentarians, the way in which ministers of the crown conduct themselves, it is important to remember that they are living, breathing documents. I would hope that if we see people, ministers and other parliamentarians, looking for loopholes that we would look at opportunities to make the acts better.
The cynicism that the member has heard in her riding is something that I have heard across the board, especially from young people. At 30 years of age, I am a young member of Parliament. I have had the opportunity to speak with many young people who feel that they are being told one thing during an election campaign and one thing during a throne speech, but the government's actions are completely different. It needs to change.",Conservative,Barrie--Springwater--Oro-Medonte,Alex Nuttall,
4658283,ca.proc.d.2016-04-19.17232.63,2016-04-19,3a48d31a-42fc-4320-a84f-da61c251bccd,412,"Mr. Blaine Calkins (Red Deer—Lacombe, CPC)",,Government Orders,Business of Supply,Opposition Motion—Political Fundraising Activities,"Mr. Speaker, my hon. colleague did a great job in presenting his case. I just want to ask my hon. colleague if he believes in some of the rhetoric that we heard from the other side about how today's debate is frivolous. Today's debate is all about a document called “Open and Accountable Government” which has been, if not penned, at least signed by the current Prime Minister of Canada. If so, is any document that the Prime Minister of Canada signs frivolous?",Conservative,Red Deer--Lacombe,Blaine Calkins,http://www.parl.gc.ca/parlinfo/Files/Parliamentarian.aspx?Item=3a48d31a-42fc-4320-a84f-da61c251bccd&Language=E&Section=ALL
4658284,ca.proc.d.2016-04-19.17232.64,2016-04-19,9ad0ff66-1598-45e6-b146-6dd0eefb9cd0,10551,Mr. Alexander Nuttall,Interjection,Government Orders,Business of Supply,Opposition Motion—Political Fundraising Activities,"Mr. Speaker, obviously, I do not believe it is frivolous. What the Prime Minister wrote set the standard and tone for how the government should conduct itself. Unfortunately, the Prime Minister also appointed people to his front bench who have failed to uphold the tenets of that document.
 I would ask the governing party to stop referring to things as being frivolous or small. These are not small issues. These are the underlying tenets of our entire democracy to which all have access. One is accountability of the government. I would ask the Prime Minister to start enforcing it.",Conservative,Barrie--Springwater--Oro-Medonte,Alex Nuttall,
4658285,ca.proc.d.2016-04-19.17232.65,2016-04-19,61c83e21-f9a3-4e4b-b881-4b2d1ce33c43,10554,"Mr. John Brassard (Barrie—Innisfil, CPC)",,Government Orders,Business of Supply,Opposition Motion—Political Fundraising Activities,"Mr. Speaker, I want to thank the member for Barrie—Springwater—Oro-Medonte for sharing his time with me today.
Before I get to the formal part of my remarks, I want to introduce Mr. George Taylor. For those in the House who do not know Mr. Taylor, he was a resident of Barrie and is the former solicitor general in the province of Ontario. I am sure you would know him, Mr. Speaker. He is a well-respected former member of the provincial legislature in Ontario. 
Just last week on Facebook, Mr. Taylor weighed in on this debate. What he had to say on Facebook was quite interesting and quite telling. I corresponded with Mr. Taylor when I was a city councillor in Barrie. I never had the chance to meet him face to face. He is an honourable man, a man of great conviction, and a man who is well respected.
 Mr. Taylor wrote on Facebook, “The Minister of Justice must have missed the conflict of interest course, as did the Ethics Commissioner, to conclude the attendance of a Tory law firm dinner, as she has said to CBC, that she was there as the MP for B.C. Law firms do not ask MPs to dinner. MPs do not appoint judges. They do not grant QCs. They give out great amounts of legal work and determine who to prosecute. The Minister of Justice is to be more independent than other ministers. She will have to learn more about her duties. You are never not a minister.”
Those are wise words from a well-respected man. 
I was at the epicentre of this issue when it started taking root. It became a regional issue. I was called to CBC on Tuesday, April 5, to comment about this issue taking place. I was not sure what it was about on my way there, but I was certainly briefed on the issue. When I walked into the CBC building, I was told by a producer that I was going to be interviewed by Mr. Terry Milewski. We knew that this story was going to have legs. We knew that it was going to be one of the lead stories on CBC. As it turned out, it was.
I asked Mr. Milewski what angle he was taking on the story. Quite clearly he told me that he had received an email from someone stating that there was an event to take place with the Minister of Justice at a law firm and that it was, in effect, a secret meeting. There were no formal invitations sent out. In fact, the email reminded people to pay for the event, $500 a ticket as we found out, by going to the Liberal Party of Canada website. However, in searching for the website, there was actually no page. There was a link that led to the website. That was the angle he was taking on the story.
What was interesting about that was the fact that there was a regional component to this. At that time, the controversy in Ontario was breaking out with the Wynne government. We were finding out then about the pay-to-play scenarios that were going on, where cabinet ministers in the Ontario Liberal government were asked to find donors, some of them up to $5,000 each, to attend functions where cabinet ministers would attend. This sounded eerily similar to what was going on in Ontario. 
Should it have surprised anyone that this in fact was going on? The reason I say that is it is quite clear now that the same players who are running the Prime Minister's office were the ones who were running the premier's office, both Premier Wynne's and McGuinty's office. It should come as no surprise to any Canadian, and it should come as no surprise to anyone in the House, that this is now happening at the federal level. 
I know it is not germane to what we are discussing here, but it should come as no surprise that we are starting to see the debt and deficit situations happen federally that we have seen in Ontario, because the Liberals now have access to a bigger piggy bank and they will surely go at it. 
What is interesting and I think is the root of what this whole debate is about, which my hon. colleague from Red Deer—Lacombe spoke about, is that on the Prime Minister's own page it states:
 For Canadians to trust our government we must trust Canadians, and we will only be successful in implementing our agenda to the extent that we earn and keep this trust. 
 To be worthy of Canadians’ trust, we must always act with integrity. [...] As Ministers, you and your staff must uphold the highest standards of honesty and impartiality, and both the performance of your official duties and the arrangement of your private affairs should bear the closest public scrutiny. This is an obligation that is not fully discharged by simply acting within the law. 
The Prime Minister goes on to state:
 I draw your attention in particular to areas of the guide that we have expanded or strengthened for our mandate, including the guidance on non-partisan use of departmental communications resources in Annex G; 
When we look at the government's website and the document entitled “Open and Accountable Government”, which was one of the tenets that the Liberals sold Canadians on during the last election, that they would truly be open and accountable, it states:
 Ministers and Parliamentary Secretaries must avoid conflict of interest, the appearance of conflict of interest and situations that have the potential to involve conflicts of interest. [...] 
 Ministers and Parliamentary Secretaries must ensure that political fundraising activities or considerations do not affect, or appear to affect, the exercise of their official duties or the access of individuals or organizations to government. [...] 
 Ministers and Parliamentary Secretaries should not seek to have departmental stakeholders included on fundraising or campaign teams or on the boards of electoral district associations. 
It goes on and on, and speaks to the issue of government ministers being held to a higher standard, as with all governments, in the areas of perceived or real conflicts of interest.
I know that the members opposite will say that it has been cleared by the Ethics Commissioner. We have seen the government House leader stand up time and again in the House and defend the justice minister. For whatever reason, the justice minister is not in a position to defend herself or does not feel that she should be defending herself. Rather, it is the government House leader who is doing that. However, it goes back to the root of the issue, which is the perception of it.
 As my hon. colleague from Barrie—Springwater—Oro-Medonte said, it does not pass the smell test. It is that question that I was asked on CBC. It does not pass the smell test. I think most Canadians would feel that way. This is about open and accountable government.
It is clear that we have gone back in time to when the Chrétien Liberals were in government. The Liberals are simply paying lip service to Canadians and to this House about their commitment to a high standard of ethical conduct. I am holding out hope that the minister and the Liberal government will do the right thing for Canadians, which is to agree with our motion today, return the money, and apologize for attending the event.
In conclusion, because I believe it is worth repeating, I will repeat what Mr. Taylor, the former solicitor general of this province, said. He stated, “The Minister of Justice is more independent than other ministers. She will have to learn of her duties, you are never not a minister.”
That night, the Minister of Justice attended that fundraising event with one of the largest law firms in the country, which has registered lobbyists who lobby on behalf of organizations right across this country, and who will deal with the justice department and the Attorney General of this country. I suggest to this House that she was a minister that night and she should apologize for her actions and give the money back.",Conservative,Barrie--Innisfil,John Brassard,
4658286,ca.proc.d.2016-04-19.17232.66,2016-04-19,b480ca59-cff5-4fed-b0ab-a833f923ef98,9487,"Mr. Frank Baylis (Pierrefonds—Dollard, Lib.)",,Government Orders,Business of Supply,Opposition Motion—Political Fundraising Activities," Mr. Speaker, the member made a good statement when he said that government ministers have to be held to a higher standard. We also heard him, and many of our colleagues on that side of the House, say that this does not pass the smell test. He also acknowledged the fact that the Conflict of Interest and Ethics Commissioner made a ruling and found nothing untoward. However, we can see that they clearly are not happy with the ruling, and they have brought this motion to make that statement. Many have risen, including this member, and have said that they are unhappy.
What I would like to learn is this. Are they unhappy with the rules, or are they unhappy with the ruling of the commissioner? Which one are they unhappy with? They are clearly unhappy. The rules have been followed, the commissioner has made a ruling that we followed the rules, and they are still unhappy. Is it the rules they are not happy with, or is it the commissioner? ",Liberal,Pierrefonds--Dollard,Frank Baylis,
4658287,ca.proc.d.2016-04-19.17232.67,2016-04-19,61c83e21-f9a3-4e4b-b881-4b2d1ce33c43,10554,Mr. John Brassard,Interjection,Government Orders,Business of Supply,Opposition Motion—Political Fundraising Activities,"Mr. Speaker, that is a fair question on the part of the hon. member.
If we look at what the Ethics Commissioner said subsequent to the ruling, she herself is not happy with the rules. She says that the rules should be looked at.
What is important here, and we are going to hear this all day, as we have heard it all morning, is the fact that it is the Prime Minister's own accountability in this situation that is being called into question. I gave various examples from the Prime Minister's own page, the expectations of his ministers, the “Open and Accountable Government” website, where it says very clearly in annex B:
 Ministers and Parliamentary Secretaries must avoid conflict of interest, the appearance of conflict of interest and situations that have the potential to involve conflicts of interest. 
That was not the Ethics Commissioner who wrote that. That was the Liberal government. That was the Prime Minister of our country who made that very clear to his ministers.
I would ask the hon. member subsequent to what he asked me, which part of that did not happen in this case?",Conservative,Barrie--Innisfil,John Brassard,
4658288,ca.proc.d.2016-04-19.17232.68,2016-04-19,3a48d31a-42fc-4320-a84f-da61c251bccd,412,"Mr. Blaine Calkins (Red Deer—Lacombe, CPC)",,Government Orders,Business of Supply,Opposition Motion—Political Fundraising Activities,"Mr. Speaker, as one of the two MPs for Barrie, I think the hon. member got the better end of the riding name stick; the other one is just too long for me to remember.
In so far as ministerial conduct is concerned, my colleague quoted from a document referring to ministerial conduct: 
 Moreover, they have an obligation to perform their official duties and arrange their private affairs in a manner that will bear the closest public scrutiny. 
When the Minister of Justice left her role as chair of the First Nations Finance Authority, her husband stepped in as the registered lobbyist, and then she went to cabinet meetings to which the Ethics Commissioner had no access to what is discussed at those meetings. Then we find a $20-million kickback in the budget to that same group. Does my colleague from Barrie—Innisfil believe that meets the test laid out by the Prime Minister?",Conservative,Red Deer--Lacombe,Blaine Calkins,http://www.parl.gc.ca/parlinfo/Files/Parliamentarian.aspx?Item=3a48d31a-42fc-4320-a84f-da61c251bccd&Language=E&Section=ALL
