basepk,hid,speechdate,pid,opid,speakeroldname,speakerposition,maintopic,subtopic,subsubtopic,speechtext,speakerparty,speakerriding,speakername,speakerurl
4657011,ca.proc.d.2016-04-12.17220.265,2016-04-12,68bad047-6aec-43e2-b870-7bc501110873,9985,Mr. Ziad Aboultaif,Interjection,Government Orders,The Budget,,"Mr. Speaker, I hope that is not a threat from an environmental advocate in the House.
I would like to point out that the issue of how much debt we left the country with has been going back and forth for some time. The debt service was $23 million a year from the previous Liberal government, which we had to maintain for nine years. If we left a $150 billion deficit, we had already paid from that previous debt another $50 billion, while managing the economy and being fiscally responsible throughout the nine years that we were governing this great country.",Conservative,Edmonton Manning,Ziad Aboultaif,
4657012,ca.proc.d.2016-04-12.17220.266,2016-04-12,77945d39-8e4a-4fd1-9786-441ff928f6f9,452,"Mr. Bev Shipley (Lambton—Kent—Middlesex, CPC)",,Government Orders,The Budget,,"Mr. Speaker, in short, there is always a problem. We just went through this budget. One of the big issues is that we gave the current government a surplus of $3.4 billion. It has blown through that, and now it is projecting a deficit of $30 billion. The Liberals' platform was that we would have a moderate deficit of $10 billion, pay off the balance, and have a balanced budget in three years. By the way, Liberals would take money from rich people and give it to the middle class. 
We have to understand that the middle class in Canada under the Conservative Party is the wealthiest it has ever been. Canada is the second most preferable country in which to do business. However, who will benefit most? It is people who make just under $200,000 a year. Now the Liberals are 300% out on their budget. The tax break was neutral, but it would now cost $2 billion per year. 
Could the member give us an idea of how Canadians can trust the budget and the Liberals' accountability?",Conservative,Lambton--Kent--Middlesex,Bev Shipley,http://www.parl.gc.ca/parlinfo/Files/Parliamentarian.aspx?Item=77945d39-8e4a-4fd1-9786-441ff928f6f9&Language=E&Section=ALL
4657013,ca.proc.d.2016-04-12.17220.267,2016-04-12,68bad047-6aec-43e2-b870-7bc501110873,9985,Mr. Ziad Aboultaif,Interjection,Government Orders,The Budget,,"Mr. Speaker, two things are flying all over the place. First of all is the misunderstanding, or pretense of misunderstanding, of the definition of the middle class by the Liberal government members throughout their campaign; and they still seem to be on the campaign trail. Second, if we have any understanding of economic indices and economic formulas, we see that the Liberals are going to put the country in debt and increase taxes. Liberals are spending Canadians' money out of their pockets and telling them they are doing this for them, but asking them to give them their mortgages, money, and savings. That does not serve Canada or Canadians.",Conservative,Edmonton Manning,Ziad Aboultaif,
4657014,ca.proc.d.2016-04-12.17220.268,2016-04-12,bd2068aa-74c7-430a-bdf5-6f17b14ca140,9453,"Mr. Tom Kmiec (Calgary Shepard, CPC)",,Government Orders,The Budget,,"Mr. Speaker, “You cannot pay a debt with a noble pedigree”; so says a Yiddish proverb. Paying down a debt takes fiscal prudence. A famous name or the performance of past governments is no replacement.
Last month I attended a financial help session aimed at laid-off professionals and skilled trades workers from the energy sector. The highlight was a presentation by the Credit Counselling Society that offered four steps for dealing with reduced incomes, budget drainers, and impulse spending.
After looking at this budget, I see the government needs to sit down and take credit counselling advice from the Calgary Credit Counselling Society. On its behalf, I am going to invite the government caucus to join me as I walk through the four steps to a sunnier tomorrow. The first step is finding sources of income that are available; it is pretty good at that. The second is finding ways to reduce expenses; not so good. Third is managing credit; equally not very good. Fourth is dealing with debts immediately; not very good.
On the first part, namely finding sources of income, the Liberals deserve a gold star. They are masters at squeezing Canadians out of just about $20 billion in tax hikes in this budget and, for business, $2 billion per year in higher taxes by 2019, and reneging on the planned tax cut for the latter and eliminating a series of tax credits for the former.
 “Other sources of income” in this case, of course, is new borrowing. The aggregate principal amount of money to be borrowed by the government from financial markets in 2016-17 is projected to be $278 billion, over $100 billion of new debt before the next election.
The result, calculated by Generation Screwed, an advocacy group for Canadian youth, is an annual interest bill of $25.7 billion in this fiscal year alone, or 8.8% of tax dollars spent on interest.
The Credit Counselling Society of Calgary also gave advice on how to temporarily increase income, from temporary work to part-time work to snow removal and bottle collection. I am not recommending that the government put its MPs to work collecting bottles to pay down the national debt, but I am also not saying that it would not help.
On page 211, the government lays out a plan to eliminate poorly targeted and inefficient measures, but if it is anything like what it did to the education and textbook tax credits or income splitting or the small business tax rate reduction or the slashing of the tax free savings account maximum, the Liberals are looking in all the wrong places for this temporary new income.
The second step offered by the Credit Counselling Society toward financial freedom is to find ways to reduce expenses. I am afraid the counselling society would sit the government down and give it heartbreaking news. It is failing and doing it all wrong.
The Liberals have thrown caution to the wind, undoing much of the spending controls put in place by the previous government and ending this past fiscal year $5.4 billion in deficit. The Liberal government has presented us with a proposed $29.4 billion budget deficit for 2016 and $113 billion in new debt over the next four years.
The election pitch put forward by members on that side of the House was to run modest deficits of $10 billion. Now we find out that the numbers are triple that, closer to $30 billion. The money is not going towards infrastructure in the vast quantities it promised. Half of the $120 billion total the government promotes is rehashed spending from the previous government.
A paltry 13.5% of the $29.4 billion in this fiscal year, or less than $4 billion, is actually designated for infrastructure. The Calgary Green Line LRT alone is estimated to cost $1.5 billion, and the construction start date is 2017. The previous Conservative government committed the funding, so will the government commit to it too? We do not know; it does not appear in the budget.
In fact, Calgary gets only one mention, for its ring road project completion. It is nice to see the government living up to the smart spending promises of the previous Conservative government.
Now the Credit Counselling Society says to use accurate numbers to work with, evaluate habits, and identify where changes can be made.
 We learned these past few days that the parliamentary budget office had to publicly force the government to release further documents that were standard in past budgets, with information request IR0217.
 The PBO also revised downwards the employment impact numbers, for not one but two fiscal years. In 2016-17, it was down to 26,000 jobs from Finance Canada's 43,000 jobs. For 2017-18, it was down to 60,000 from 100,000 jobs.
Many tools exist to make budget tracking easier. I am going to recommend the smart phone apps Mint or TrackIt from the Alberta Treasury Branches. I am happy to sit down with the Minister of Finance, download it to his phone, and get it working so that he can begin tracking his government's spending habits. We could identify some of those budget drainers the credit counsellors keep warning against.
The budget is littered with half measures with expensive price tags. For example, on page 257 of the budget document, under “Other spending measures”, there is a subheading that also reads “Other measures”, and there is a whopping $620 million this fiscal year and $292 million in the next. Out of the 10 line items in there, it happens to be the biggest one, so the other of the other is actually the most expensive thing that the Liberals are spending on. 
Just as Canadians track their expenses, the Liberals too should focus on what is straining their budget by asking themselves where the money is going. 
Here is a question a credit counsellor might ask: “Are you helping out someone, such as family or friends, when you cannot afford it?”
I have noticed that on almost every single international visit, the Liberals come bearing gifts. For example, in their first 100 days in power, they made $5.3 billion in spending commitments. There was just $997 million for projects inside Canada, and the rest, $4.3 billion, is to be spent outside the country.
Now, the logic and accounting here are pretty darn simple. Do we want to get into financial trouble? If not, then we either have to start making more money, cut back on expenses, or both. It is a simple principle that credit counsellors apply and one that would not hurt the Liberals to adopt.
This budget is especially troubling for families like the McAllisters in my riding: Maja and Darcy, and their kids Liam and Veronica. Darcy makes his living in the oil and gas industry, like thousands of others in my riding, and they are seeing a government completely undermining the source of their prosperity.
The third part of Calgary's Credit Counselling Society's strategy is to deal with one's debt. The government misses the mark here yet again. We see on page 53 a mention that they will repeal the Federal Balanced Budget Act. There will not be amendments, but a complete and entire repeal, a full elimination of the act. Not only do the Liberals have a spending problem, but they will not admit that they need to be put on a debt diet. 
To deal with government, we typically see a series of fiscal anchors—legislative and policy measures—that help guide the government's overall efforts to control spending. However, the Liberals do not have these here. In fact, they have dropped the only anchor straight into an abyss of perpetual debt. 
As an Albertan, I look to the former example of Premier Ralph Klein and his deficit- and debt-fighting battle. He won because he created strong legislative anchors. He and his ministers fixed strong policy measures as well. Most of all, he provided fixed, strong leadership on what he needed and wanted to achieve. Ralph Klein, Jim Dinning, Steve West, Stockwell Day, and many others provided leadership provincially and knew when to drop anchor and balance Alberta's budget.
However, the current government offers us annex 3 on page 259, the debt management strategy, which is more concerned with where new debt will be acquired rather than with how it will be paid down. Credit counsellors point out that among the top reasons for financial struggle among Canadians is the excessive use of credit for living expenses. What the Liberals are proposing is the same principle.
Let us not forget that there is an interest cost for borrowing such huge amounts of money, so let us look at what happens when government increases debt. The Ontario Liberal government spent $11.4 billion a year just to make interest payments on its debt. If debt were a government department, it would be the third largest in that province. Let us ask ourselves what future generations could do instead of paying interest on that debt. 
However, it does not stop there. 
We know that key interest rates have already gone up in the United States and that the Bank of Canada will eventually follow suit at some point in the near future. This will affect not only indebted consumers but also the amount of financial resources directed to debt servicing costs. 
What will the Liberals do when interest rates rise or double? Are they saying it will not happen over the next decade or so? They have no plan. 
Let us talk about impulse spending. Credit counsellors ask people if they have ever bought something and then regretted it. The acronym is TEMPO: time, environment, mood, place, and occasion. Credit counsellors offer some strategies to deal with this impulse spending, and I want to recommend a few things here.
The government should stop international trips, because those seem to be quite expensive. The Liberals should pay attention to details. They call it “stress fog” when someone buys on impulse. It would have helped the Liberals avoid the embarrassment of ending income splitting for couples with children and saying that it would be offset by raising taxes on the 1%, because the parliamentary budget officer said that no, that is actually not the case. 
Is it possible that question period is stressing out the ministers responsible for the finances of our country? They would be less stressed if they brought real answers to the questions from this side of the House, and the truth is a great stress reliever.
 The government needs to focus on prudence. The 1970s fiscal and economic policy led by another famous prime minister is of no help here. A famous name cannot save them here. 
With this budget, the Liberals have thrown caution to the wind, betrayed the middle class, and placed Canada on a path of structural deficit. They have irresponsibly endangered our financial stability, meaning that in the next recession, with record spending and record low interest rates, there will be no space for a future government to respond.
However, I bring good news: it is not too late to stop. I would be happy to share the presentation from the Credit Counselling Society, its contact information, and its flagship website, www.nomoredebts.org. Its advice is confidential. Good news: no-cost credit and budget counselling from the consumer experts is only a call away.",Conservative,Calgary Shepard,Tom Kmiec,
4657015,ca.proc.d.2016-04-12.17220.269,2016-04-12,0ac173b3-8d7f-40ce-a34c-aabda1c5b54e,10309,"Ms. Jennifer O'Connell (Pickering—Uxbridge, Lib.)",,Government Orders,The Budget,,"Mr. Speaker, my hon. colleague mentioned that the budget is producing tax increases. Perhaps the hon. member has not actually seen the budget or reviewed it. There are actually $3.4 billion in tax reductions for nine million Canadians in the budget.
The Conservative Party does not support our reduction of the TFSA limits. There were only approximately two million Canadians who actually maximized those contributions, yet that program would cost over $210 million, and those who maximized their TFSAs were actually the highest-earning income earners in this country.
 Is that prudent governance? Is it prudent governance to provide a costly program to a comparatively small number of Canadians, a program that actually does not help the majority of Canadians, the middle class, specifically?",Liberal,Pickering--Uxbridge,Jennifer O'Connell,
4657016,ca.proc.d.2016-04-12.17220.270,2016-04-12,bd2068aa-74c7-430a-bdf5-6f17b14ca140,9453,Mr. Tom Kmiec,Interjection,Government Orders,The Budget,,"Mr. Speaker, actually I have read the budget intently. It is highlighted, and I have Post-it Notes in it.
Let us talk about the numbers in the budget on pages 234 and 235 of Annex 1. Let us talk about the personal income tax numbers the Liberals have here, because what I see in this document is that over the next five years, they expect almost a 24% increase in personal income taxes. In fact, between the fiscal years 2016-17 and 2017-18, they expect to get $10 billion more in personal income taxes from the taxpayers of this country.
When we talk about numbers, it is right here in black and white. Their expectations are completely offside and they really do not know what they are doing.",Conservative,Calgary Shepard,Tom Kmiec,
4657017,ca.proc.d.2016-04-12.17220.271,2016-04-12,41c4a234-7472-4511-a49a-d09355b4c726,8836,"Mr. Kyle Peterson (Newmarket—Aurora, Lib.)",,Government Orders,The Budget,,"Mr. Speaker, I appreciate that contribution from the member for Calgary Shepard. Frankly, he is being quite generous with his unsolicited credit counselling services.
I have a quick question for him. Where were these services in 2007? Where were these services in 2008? Where were these services in 2009? Where were these services in 2010? Where were these services in 2011? Where were these services in 2012? Where were these services in 2013? Where were these services in 2014?
I wonder why he was not willing to avail the former government of his wonderful credit counselling services during that decade of darkness.",Liberal,Newmarket--Aurora,Kyle Peterson,
4657018,ca.proc.d.2016-04-12.17220.272,2016-04-12,bd2068aa-74c7-430a-bdf5-6f17b14ca140,9453,Mr. Tom Kmiec,Interjection,Government Orders,The Budget,,"Mr. Speaker, I would like to thank the member for the question and for the passionate way he delivered it as well.
As he knows, I am a rookie member of this House and I have just joined the floor here, but I have been an attentive spectator. As I remember it, it was that party when it was in opposition that demanded more spending. It wanted more spending. Actually, the Liberals aligned themselves with the New Democrats and the separatists in order to create a coalition government, demanding even more spending.
The Credit Counselling Society in Calgary has been there for decades. Any time they would like to call them, I am more than happy to provide the PowerPoint presentation. I will even provide the phone number. They can come to my riding and we can sit down together and have a great meeting over this document.",Conservative,Calgary Shepard,Tom Kmiec,
4657019,ca.proc.d.2016-04-12.17220.273,2016-04-12,831322ab-9fa6-437e-92ba-1b4525f8242d,9649,"Mr. Pat Kelly (Calgary Rocky Ridge, CPC)",,Government Orders,The Budget,,"Mr. Speaker, I would like to thank the member for Calgary Shepard for his presentation. I very much enjoyed the allegory and the way he colourfully expressed the shortcomings of budget 2016. It was an excellent presentation.
At the very end of his presentation, he mentioned the difficulties around the challenges when we get into structural deficit. Perhaps the credit counsellors might say that capital deficit is one thing, but that when we get into structural deficit, the financing of day-to-day expenses through borrowing, it is a treadmill that is very difficult to get off and is extremely destructive as public policy.
Would he comment on the difference and on how the government is leading us directly down the road to structural deficit?",Conservative,Calgary Rocky Ridge,Pat Kelly,
4657020,ca.proc.d.2016-04-12.17220.274,2016-04-12,bd2068aa-74c7-430a-bdf5-6f17b14ca140,9453,Mr. Tom Kmiec,Interjection,Government Orders,The Budget,,"Mr. Speaker, the member and I are both from Calgary. He is a great champion for the taxpayer.
What I would say on that is that on page 53 of the budget, we see that the government intends to repeal the Federal Balanced Budget Act, thereby getting rid of the last fiscal anchor that would have prevented structural deficits. 
Also, 13.5% of the Liberals' spending plan is with respect to infrastructure, which means the rest of it is simply program spending. That is how structural deficits are created over time. It is by having no fiscal anchors.
 Unfortunately, Alberta has gone through this before. Alberta is an example of legislative and policy measures being eliminated over time, causing future deficits to be created that became the structural deficits that governments have struggled to deal with. 
The current government can learn a lot by not repeating the mistakes of the past. There are a lot of examples out there, and it can do better.",Conservative,Calgary Shepard,Tom Kmiec,
