basepk,hid,speechdate,pid,opid,speakeroldname,speakerposition,maintopic,subtopic,subsubtopic,speechtext,speakerparty,speakerriding,speakername,speakerurl
4658351,ca.proc.d.2016-04-19.17232.131,2016-04-19,031462db-8f61-48ed-bf9f-b033eb8312bb,75,"Mr. Nathan Cullen (Skeena—Bulkley Valley, NDP)",,Oral Questions,The Environment,,"Mr. Speaker, the fact is that, when asked when things would actually get better with respect to climate change and greenhouse gas emissions, the minister could not even offer an answer.
The Prime Minister went to Paris with no targets, no plan to get there, and no accountability to keep his government honest. Then the Prime Minister met with the premiers and came away with no targets, no plan, and no accountability. Now the Prime Minister is jetting off to New York City with no plan, no targets, and no accountability. 
Exactly how are these Liberals all that different from the Chrétien Liberals who failed us so miserably?",New Democratic Party,Skeena--Bulkley Valley,Nathan Cullen,http://www.parl.gc.ca/parlinfo/Files/Parliamentarian.aspx?Item=031462db-8f61-48ed-bf9f-b033eb8312bb&Language=E&Section=ALL
4658352,ca.proc.d.2016-04-19.17232.132,2016-04-19,b8c04eca-f237-48a8-8975-374ccd40d1a9,567,"Right Hon. Justin Trudeau (Prime Minister, Lib.)",,Oral Questions,The Environment,,"Mr. Speaker, I thank the hon. member for his hard work and his devotion to the environment. It is something that we share.
We know that Canada needs to do more on the environment. That is why we have demonstrated every step of the way that we understand that building a strong economy goes hand in hand with protecting the environment.
That is the leadership we showed at Paris. That is the leadership we continue to show on the world stage; and that is the hard work we are doing with our provincial partners and with municipalities to make sure that Canada once again has a well-earned reputation as a leader on the environmental file right across the world.",Liberal,Papineau,Justin Trudeau,http://www.parl.gc.ca/parlinfo/Files/Parliamentarian.aspx?Item=b8c04eca-f237-48a8-8975-374ccd40d1a9&Language=E&Section=ALL
4658353,ca.proc.d.2016-04-19.17232.133,2016-04-19,3a48d31a-42fc-4320-a84f-da61c251bccd,412,"Mr. Blaine Calkins (Red Deer—Lacombe, CPC)",,Oral Questions,Ministerial Expenses,,"Mr. Speaker, today, in an effort to cover her tracks, the Minister of International Trade said her trade meetings in Los Angeles were booked before her HBO interview.
However, originally her HBO appearance was supposed to be on October 30. That was before she was even sworn in as minister. 
This meeting was then postponed until November 20, so on what day did her staff start booking the LA meetings? Is she saying that they started even before she was the minister?",Conservative,Red Deer--Lacombe,Blaine Calkins,http://www.parl.gc.ca/parlinfo/Files/Parliamentarian.aspx?Item=3a48d31a-42fc-4320-a84f-da61c251bccd&Language=E&Section=ALL
4658354,ca.proc.d.2016-04-19.17232.134,2016-04-19,3dd9162a-4763-4000-8c8a-706a788f7e50,9265,"Hon. Chrystia Freeland (Minister of International Trade, Lib.)",,Oral Questions,Ministerial Expenses,,"Mr. Speaker, once again the Conservatives are trying to concoct a story where there is none.
It is my job to promote Canada and Canadian business around the world. Following the APEC summit in the Philippines, I was proud to visit California, one of our largest trading partners, larger than Japan, Germany, or the U.K., where I held six business round tables.
The Conservatives' accusations are absolutely wrong. All of our expenses were clearly posted months before this was raised. ",Liberal,University--Rosedale,Chrystia Freeland,http://www.parl.gc.ca/parlinfo/Files/Parliamentarian.aspx?Item=3dd9162a-4763-4000-8c8a-706a788f7e50&Language=E&Section=ALL
4658355,ca.proc.d.2016-04-19.17232.135,2016-04-19,3a48d31a-42fc-4320-a84f-da61c251bccd,412,"Mr. Blaine Calkins (Red Deer—Lacombe, CPC)",,Oral Questions,Ministerial Expenses,,"Mr. Speaker, the Minister of International Trade's story just does not add up. She had a reserved seat on the government jet leaving Manilla, but she wanted some TV time on a popular U.S. show, so the minister instructed her staff to book some last-minute meetings and a first class ticket for her personal vanity project.
This minister cost Canadian taxpayers almost $20,000 just so she could get schooled by an American comedian. Why does the minister believe that Canadians should have to pay for her hard-knock life lessons?",Conservative,Red Deer--Lacombe,Blaine Calkins,http://www.parl.gc.ca/parlinfo/Files/Parliamentarian.aspx?Item=3a48d31a-42fc-4320-a84f-da61c251bccd&Language=E&Section=ALL
4658356,ca.proc.d.2016-04-19.17232.136,2016-04-19,3dd9162a-4763-4000-8c8a-706a788f7e50,9265,"Hon. Chrystia Freeland (Minister of International Trade, Lib.)",,Oral Questions,Ministerial Expenses,,"Mr. Speaker, unlike the Conservatives, who do not really like the media, I know it is my job to promote Canada to the world.
In California, I appeared in the media with U.S. Senator Angus King of Maine and with Lieutenant Governor Gavin Newsom of California. I also spoke to the LA Times, which wrote a column about our economic policy, and I very proudly defended Canada's support for Syrian refugees, something I will do again and again.",Liberal,University--Rosedale,Chrystia Freeland,http://www.parl.gc.ca/parlinfo/Files/Parliamentarian.aspx?Item=3dd9162a-4763-4000-8c8a-706a788f7e50&Language=E&Section=ALL
4658357,ca.proc.d.2016-04-19.17232.137,2016-04-19,16ec30ba-16f2-4777-ab8d-db372238e239,9568,"Mrs. Karen Vecchio (Elgin—Middlesex—London, CPC)",,Oral Questions,Ministerial Expenses,,"Mr. Speaker, the fact is the Minister of International Trade spent $20,000 on an all-inclusive vanity trip to Hollywood, and to cover up this junket in Los Angeles, she instructed her department to create a few meetings, so that hopefully nobody would notice.
Does the minister really think Canadians believe she just happened to be in LA on business when HBO called, or does she think concocting last-minute meetings will make everything okay?",Conservative,Elgin--Middlesex--London,Karen Vecchio,
4658358,ca.proc.d.2016-04-19.17232.138,2016-04-19,3dd9162a-4763-4000-8c8a-706a788f7e50,9265,"Hon. Chrystia Freeland (Minister of International Trade, Lib.)",,Oral Questions,Ministerial Expenses,,"Mr. Speaker, I have already answered that question, but since the members opposite are so interested in my promotion of Canada in California, let me talk about some of the meetings I held.
I met with U.S. Senator Angus King of Maine. I met with the Lieutenant Governor of California, Gavin Newsom. I met with Jim Haney, who is the senior VP and GM of City National Bank, recently acquired by RBC. I met with Greg Foster, the CEO of IMAX, a great Canadian company active in California. 
I met with Creative BC and Trade and Invest B.C. I met with John Chiang, the treasurer of California. I met with Jeff Gorell, the deputy mayor of Los Angeles. There is more, but I have run out of time.",Liberal,University--Rosedale,Chrystia Freeland,http://www.parl.gc.ca/parlinfo/Files/Parliamentarian.aspx?Item=3dd9162a-4763-4000-8c8a-706a788f7e50&Language=E&Section=ALL
4658359,ca.proc.d.2016-04-19.17232.139,2016-04-19,16ec30ba-16f2-4777-ab8d-db372238e239,9568,"Mrs. Karen Vecchio (Elgin—Middlesex—London, CPC)",,Oral Questions,Ministerial Expenses,,"Mr. Speaker, the minister took a self-promoting vanity trip to Hollywood. She billed the taxpayers $20,000 for this trip. She directed her staff to find meetings to try to justify this trip. She even double-billed the taxpayers for dinner in Toronto after she returned home from her trip.
When will this minister pay back Canadian taxpayers who shelled out so she could hobnob with Hollywood elite?",Conservative,Elgin--Middlesex--London,Karen Vecchio,
4658360,ca.proc.d.2016-04-19.17232.140,2016-04-19,3dd9162a-4763-4000-8c8a-706a788f7e50,9265,"Hon. Chrystia Freeland (Minister of International Trade, Lib.)",,Oral Questions,Ministerial Expenses,,"As I have said, Mr. Speaker, the Conservatives are trying to concoct a story where there is none. Whether it is interviews with The Washington Post editorial board, the LA Times, BBC, or the many media interviews I did with German newspapers and with Bloomberg promoting CETA in Berlin last week, it is my proud job to promote Canada to the world.
Unlike the Conservatives, our open and transparent government speaks to the media, including international media. The Conservatives did everything possible to insult the media. We are doing things differently.",Liberal,University--Rosedale,Chrystia Freeland,http://www.parl.gc.ca/parlinfo/Files/Parliamentarian.aspx?Item=3dd9162a-4763-4000-8c8a-706a788f7e50&Language=E&Section=ALL
4658361,ca.proc.d.2016-04-19.17232.141,2016-04-19,7f45dfd9-dd4b-4b04-8dc9-20cb0730d279,428,"Mr. Jacques Gourde (Lévis—Lotbinière, CPC)",,Oral Questions,Ministerial Expenses,,"Mr. Speaker, yesterday, we learned that the Minister of International Trade spent nearly $20,000 so that she could appear on a Hollywood talk show. That $20,000 was taken from the pockets of the same Canadians and middle-class families that this government claims it wants to help. That is unacceptable. The minister's travel plans clearly show that the main reason for the trip was the interview with HBO.
Will the minister at least acknowledge that fact?",Conservative,Lévis--Lotbinière,Jacques Gourde,http://www.parl.gc.ca/parlinfo/Files/Parliamentarian.aspx?Item=7f45dfd9-dd4b-4b04-8dc9-20cb0730d279&Language=E&Section=ALL
4658362,ca.proc.d.2016-04-19.17232.142,2016-04-19,3dd9162a-4763-4000-8c8a-706a788f7e50,9265,"Hon. Chrystia Freeland (Minister of International Trade, Lib.)",,Oral Questions,Ministerial Expenses,,"Mr. Speaker, once again, the Conservatives are trying to concoct a story where there is none. It is my job to promote Canada around the world, and I am proud of that. Following the APEC summit in the Philippines, I was proud to go to California for a trade visit. As everyone knows, California is one of our largest trading partners.
I repeat: the Conservatives' accusations are wrong, and all the rules were followed. ",Liberal,University--Rosedale,Chrystia Freeland,http://www.parl.gc.ca/parlinfo/Files/Parliamentarian.aspx?Item=3dd9162a-4763-4000-8c8a-706a788f7e50&Language=E&Section=ALL
4658363,ca.proc.d.2016-04-19.17232.143,2016-04-19,7f45dfd9-dd4b-4b04-8dc9-20cb0730d279,428,"Mr. Jacques Gourde (Lévis—Lotbinière, CPC)",,Oral Questions,Ministerial Expenses,,"Mr. Speaker, in addition to learning that the Minister of International Trade wanted to be reimbursed for expenses that she should not have claimed, we learned that the Quebec wing of the Liberal Party of Canada had to fire its treasurer, Jean-François Lalonde, because an investigation by the chief electoral officer of Quebec revealed that he had committed electoral fraud.
 Mr. Lalonde was fired. What will happen to the Minister of International Trade?",Conservative,Lévis--Lotbinière,Jacques Gourde,http://www.parl.gc.ca/parlinfo/Files/Parliamentarian.aspx?Item=7f45dfd9-dd4b-4b04-8dc9-20cb0730d279&Language=E&Section=ALL
4658364,ca.proc.d.2016-04-19.17232.144,2016-04-19,44647433-13cb-467e-8632-d49b131d5bb6,166,"Hon. Dominic LeBlanc (Leader of the Government in the House of Commons, Lib.)",,Oral Questions,Ministerial Expenses,,"Mr. Speaker, I have to give my colleague credit for lumping together two or three different issues. He knows full well that the president of the Liberal Party of Canada in Quebec asked Mr. Lalonde to step down from his volunteer duties on the board of directors. He also knows full well that the charges laid by the chief electoral officer of Quebec have nothing to do with Mr. Lalonde's role in the Liberal Party of Canada in Quebec.",Liberal,Beauséjour,Dominic LeBlanc,http://www.parl.gc.ca/parlinfo/Files/Parliamentarian.aspx?Item=44647433-13cb-467e-8632-d49b131d5bb6&Language=E&Section=ALL
4658365,ca.proc.d.2016-04-19.17232.145,2016-04-19,0c9d00b0-a035-46d3-ba51-0db3e8da19b8,9253,"Mr. Murray Rankin (Victoria, NDP)",,Oral Questions,Canada Revenue Agency,,"Mr. Speaker, problems at the Canada Revenue Agency just keep mounting: officials being wined and dined by the very people they are meant to investigate, a senior investigator going over to the company in the middle of a court case, secret sweetheart deals that let millionaire tax cheats off the hook with no penalties. This is an outrage. Canadians are tired of the wealthy and well-connected getting all the tax breaks. 
When will the minister stop defending the indefensible and announce an investigation into the KPMG tax scandal?",New Democratic Party,Victoria,Murray Rankin,http://www.parl.gc.ca/parlinfo/Files/Parliamentarian.aspx?Item=0c9d00b0-a035-46d3-ba51-0db3e8da19b8&Language=E&Section=ALL
4658366,ca.proc.d.2016-04-19.17232.146,2016-04-19,c58bb7da-2385-4bbf-a8f1-b781f634a80c,9666,"Hon. Diane Lebouthillier (Minister of National Revenue, Lib.)",,Oral Questions,Canada Revenue Agency,,"Mr. Speaker, the Canada Revenue Agency's budget for 2016 is unprecedented and historic: $444 million. That investment will enable the agency to improve its client service, support the government's efforts to fight tax evasion and tax avoidance, and improve the agency's ability to collect outstanding tax debts.",Liberal,Gaspésie--Les-Îles-de-la-Madeleine,Diane Lebouthillier,
4658367,ca.proc.d.2016-04-19.17232.147,2016-04-19,4c0122f7-7958-4cbd-b99e-9d70a4dca1e8,8678,"Mr. Pierre-Luc Dusseault (Sherbrooke, NDP)",,Oral Questions,Canada Revenue Agency,,"Mr. Speaker, the minister should put her cue cards down for a minute and use some common sense.
She is still defending the indefensible. This is not just about accountants participating in professional association events. This is about senior officials taking part in secret meetings at the Rideau Club.
What does she not understand about the appearance of conflict of interest? When will she put an end to these practices? When will she tell her officials that the Rideau Club is over and there will be no more secret meetings, period?",New Democratic Party,Sherbrooke,Pierre-Luc Dusseault,http://www.parl.gc.ca/parlinfo/Files/Parliamentarian.aspx?Item=4c0122f7-7958-4cbd-b99e-9d70a4dca1e8&Language=E&Section=ALL
4658368,ca.proc.d.2016-04-19.17232.148,2016-04-19,c58bb7da-2385-4bbf-a8f1-b781f634a80c,9666,"Hon. Diane Lebouthillier (Minister of National Revenue, Lib.)",,Oral Questions,Canada Revenue Agency,,"Mr. Speaker, my NDP colleague is choosing to doubt the professionalism of public servants. He should listen to his colleague from Jonquière, who had this to say in the House yesterday:
 I am proud of Canada's public servants, the services they provide, and their professionalism. 
I trust the agency employees to conduct themselves professionally. They are expected to adhere to the code of integrity and professional conduct. Every invitation they receive must be assessed in order to avoid the appearance of a conflict of interest. ",Liberal,Gaspésie--Les-Îles-de-la-Madeleine,Diane Lebouthillier,
4658369,ca.proc.d.2016-04-19.17232.149,2016-04-19,a5da7604-b429-46d1-b702-0e3be1febcec,869,"Mr. Bob Saroya (Markham—Unionville, CPC)",,Oral Questions,"Immigration, Refugees and Citizenship",,"Mr. Speaker, once again, the Liberals' lack of planning has resulted in Syrian refugees being extorted by crooked immigration consultants. These consultants are charging Syrian refugees thousands of dollars and selling them false hope of coming to Canada. 
The previous Conservative government cracked down on crooked consultants. When are the Liberals going to close the door on those who are taking advantage of the most vulnerable?",Conservative,Markham--Unionville,Bob Saroya,
4658370,ca.proc.d.2016-04-19.17232.150,2016-04-19,826dc268-dbda-48fa-ae4a-eefebd5716e1,191,"Hon. John McCallum (Minister of Immigration, Refugees and Citizenship, Lib.)",,Oral Questions,"Immigration, Refugees and Citizenship",,"Mr. Speaker, such behaviour is clearly against the rules and the perpetrators will be held to account. If judged appropriate by the appropriate authorities, they could be charged as well under criminal law.
That being said, the vast majority of Canadians are displaying extraordinary generosity to the Syrian refugees.",Liberal,Markham--Thornhill,John McCallum,http://www.parl.gc.ca/parlinfo/Files/Parliamentarian.aspx?Item=826dc268-dbda-48fa-ae4a-eefebd5716e1&Language=E&Section=ALL
4658371,ca.proc.d.2016-04-19.17232.151,2016-04-19,61c83e21-f9a3-4e4b-b881-4b2d1ce33c43,10554,"Mr. John Brassard (Barrie—Innisfil, CPC)",,Oral Questions,"Immigration, Refugees and Citizenship",,"Mr. Speaker, immigration consultants in partnership with refugee sponsorship groups are violating federal rules. A Mississauga organization called Fast to Canada has refugees paying from $12,000 to $32,000 before arriving in Canada. The group's website displays the logo of the Immigration Consultants of Canada Regulatory Council and indicates it is a member.
What is the minister doing to protect legitimate refugees fleeing a dangerous situation from being defrauded?",Conservative,Barrie--Innisfil,John Brassard,
4658372,ca.proc.d.2016-04-19.17232.152,2016-04-19,826dc268-dbda-48fa-ae4a-eefebd5716e1,191,"Hon. John McCallum (Minister of Immigration, Refugees and Citizenship, Lib.)",,Oral Questions,"Immigration, Refugees and Citizenship",,"Mr. Speaker, as I just said, such behaviour will not be tolerated. It is possible that sponsorship agreements could be terminated or the refugee could be not allowed, or if deemed appropriate by the authorities, such individuals or organizations could be charged. 
This behaviour is not tolerated by this government and perpetrators will be held to account.",Liberal,Markham--Thornhill,John McCallum,http://www.parl.gc.ca/parlinfo/Files/Parliamentarian.aspx?Item=826dc268-dbda-48fa-ae4a-eefebd5716e1&Language=E&Section=ALL
4658373,ca.proc.d.2016-04-19.17232.153,2016-04-19,61c83e21-f9a3-4e4b-b881-4b2d1ce33c43,10554,"Mr. John Brassard (Barrie—Innisfil, CPC)",,Oral Questions,"Immigration, Refugees and Citizenship",,"Mr. Speaker, yesterday the immigration minister would not say how much the Syrian refugee program will cost Canadians. He said it will come under budget, but there is no budget. The minister also admitted that 13% of refugees, or 3,400 people, are still in hotels.
The Liberals renovated five Canadian Forces bases for 6,100 people costing $6.4 million. Why did the Liberals blow millions of dollars displacing troops over Christmas to house refugees with no intent on using the bases?",Conservative,Barrie--Innisfil,John Brassard,
4658374,ca.proc.d.2016-04-19.17232.154,2016-04-19,826dc268-dbda-48fa-ae4a-eefebd5716e1,191,"Hon. John McCallum (Minister of Immigration, Refugees and Citizenship, Lib.)",,Oral Questions,"Immigration, Refugees and Citizenship",,"Talk about a glass half empty or half full, Mr. Speaker.
I said yesterday that 87% of the refugees have now found permanent housing. That is a very large number and we should be pleased with it. The remaining 13% will find permanent housing very soon.
My colleague beside me, the Minister of National Defence, confirms there is nothing truthful in the member's comments about defence.",Liberal,Markham--Thornhill,John McCallum,http://www.parl.gc.ca/parlinfo/Files/Parliamentarian.aspx?Item=826dc268-dbda-48fa-ae4a-eefebd5716e1&Language=E&Section=ALL
4658375,ca.proc.d.2016-04-19.17232.155,2016-04-19,75d4be3f-f1cf-499d-882b-6415247900e6,10340,"Mr. Alain Rayes (Richmond—Arthabaska, CPC)",,Oral Questions,"Immigration, Refugees and Citizenship",,"Mr. Speaker, this morning we learned that some immigration consultants are charging Syrian refugees fees of more than $32,000 to process their applications to the federal government. When a program is fast-tracked, there are sometimes weaknesses and, unfortunately, some people take advantage of those weaknesses.
Can the Minister of Immigration assure this House that no refugees applying to come to Canada are being exploited by immigration consultants?",Conservative,Richmond--Arthabaska,Alain Rayes,
4658376,ca.proc.d.2016-04-19.17232.156,2016-04-19,826dc268-dbda-48fa-ae4a-eefebd5716e1,191,"Hon. John McCallum (Minister of Immigration, Refugees and Citizenship, Lib.)",,Oral Questions,"Immigration, Refugees and Citizenship",,"Mr. Speaker, yes, I can assure the members of this House that that kind of behaviour will not be tolerated. Guilty parties will be punished under the law, where the authorities see fit, or by other means. This kind of behaviour will not be tolerated in Canada.",Liberal,Markham--Thornhill,John McCallum,http://www.parl.gc.ca/parlinfo/Files/Parliamentarian.aspx?Item=826dc268-dbda-48fa-ae4a-eefebd5716e1&Language=E&Section=ALL
4658377,ca.proc.d.2016-04-19.17232.157,2016-04-19,53435570-da9e-42e1-a195-e5475a2f8b13,9994,"Ms. Georgina Jolibois (Desnethé—Missinippi—Churchill River, NDP)",,Oral Questions,Indigenous Affairs,,"Mr. Speaker, the process of reconciliation is a long one. Residential school survivors opened deep wounds to share their stories and placed their trust in other parties to hold up their end of the deal. Our collective healing depends upon it. We cannot let a legal mistake by government lawyers jeopardize justice for survivors. 
The parliamentary secretary was not clear yesterday, so I ask again, will the government ensure full payment for the victims of residential schools?",New Democratic Party,Desnethé--Missinippi--Churchill River,Georgina Jolibois,
4658378,ca.proc.d.2016-04-19.17232.158,2016-04-19,f470e27a-a074-4b16-8304-960ffe8c9289,24,"Hon. Carolyn Bennett (Minister of Indigenous and Northern Affairs, Lib.)",,Oral Questions,Indigenous Affairs,,"Mr. Speaker, all parties to the settlement agreement have a critical role in reconciliation. We believe that the Catholic Church has to honour its obligation. This is not the time to get off on a technicality. Catholic people from coast to coast to coast in this country expect their church to honour this obligation and get on with the reconciliation and they, I am sure, will help in this endeavour.",Liberal,Toronto--St. Paul's,Carolyn Bennett,http://www.parl.gc.ca/parlinfo/Files/Parliamentarian.aspx?Item=f470e27a-a074-4b16-8304-960ffe8c9289&Language=E&Section=ALL
4658379,ca.proc.d.2016-04-19.17232.159,2016-04-19,13a21d52-bc44-4a96-a206-f18432ef9191,8606,"Mr. Romeo Saganash (Abitibi—Baie-James—Nunavik—Eeyou, NDP)",,Oral Questions,Indigenous Affairs,,"Mr. Speaker, for the victims, the obligations imposed on the Catholic Church were part of the justice and healing process.
Because of a government error, the church can now shirk its obligations. We simply cannot abandon the survivors and their families yet again, for they are still living with the painful legacy of residential schools.
Will the government make a firm commitment today that the victims will receive the compensation they were promised?",New Democratic Party,Abitibi--Baie-James--Nunavik--Eeyou,Romeo Saganash,http://www.parl.gc.ca/parlinfo/Files/Parliamentarian.aspx?Item=13a21d52-bc44-4a96-a206-f18432ef9191&Language=E&Section=ALL
4658380,ca.proc.d.2016-04-19.17232.160,2016-04-19,f470e27a-a074-4b16-8304-960ffe8c9289,24,"Hon. Carolyn Bennett (Minister of Indigenous and Northern Affairs, Lib.)",,Oral Questions,Indigenous Affairs,,"Mr. Speaker, I thank the member for Abitibi—Baie-James—Nunavik—Eeyou for his question.
All parties to the Indian Residential Schools Settlement Agreement have a crucial role to play in renewing their relationship with Canada's indigenous peoples and in reconciliation, although the previous government left no legal recourse. 
However, it is up to the officials of the Catholic Church to do the right thing and fix—",Liberal,Toronto--St. Paul's,Carolyn Bennett,http://www.parl.gc.ca/parlinfo/Files/Parliamentarian.aspx?Item=f470e27a-a074-4b16-8304-960ffe8c9289&Language=E&Section=ALL
4658381,ca.proc.d.2016-04-19.17232.161,2016-04-19,3176068f-62ee-4b2f-aacd-1131201c6db1,242,The Speaker,,Oral Questions,Indigenous Affairs,,"Order.
The hon. member for Mississauga—Streetsville.",Liberal,Halifax West,Geoff Regan,http://www.parl.gc.ca/parlinfo/Files/Parliamentarian.aspx?Item=3176068f-62ee-4b2f-aacd-1131201c6db1&Language=E&Section=ALL
4658382,ca.proc.d.2016-04-19.17232.162,2016-04-19,8942c6f2-bfc8-4275-97bb-a5086a07138e,9927,"Mr. Gagan Sikand (Mississauga—Streetsville, Lib.)",,Oral Questions,Taxation,,"Mr. Speaker, the leak of the Panama papers has highlighted the need for collective action to crack down on people and companies who are trying to get out of paying their fair share of taxes.
 At last week's G20 finance ministers' meetings, the world's major economies took a united public stand on tax dodging and sent a strong warning to other countries that are not meeting their international commitments.
As Canada's representative at the G20 finance ministers' meetings, would our Minister of Finance tell us how he is contributing to international efforts and the measures here at home?",Liberal,Mississauga--Streetsville,Gagan Sikand,
4658383,ca.proc.d.2016-04-19.17232.163,2016-04-19,5d3dfa7b-f157-4019-ac2a-4dab0cb15f92,10201,"Hon. Bill Morneau (Minister of Finance, Lib.)",,Oral Questions,Taxation,,"Mr. Speaker, I would like to assure my colleague, the member for Mississauga—Streetsville, that we were a strong voice at the G20 meetings around cracking down on tax avoidance and tax evasion.
We committed that we will move forward on the common reporting standards and work toward those standards internationally. We committed that we will follow through on base erosion and profit shifting deliverables. We are committed to combatting any sort of tax evasion in Canada and abroad.",Liberal,Toronto Centre,Bill Morneau,
